"TaxonomyID","Genome","read_count","Proportion","readsEM","EMProportion"
"1638985","Demequina rhizosphaerae strain NBRC 109397, whole genome shotgun sequence",4,2.71087746359461e-06,5.9,3.99952751534086e-06
"1792835","Mycolicibacter icosiumassiliensis strain 8WA6, whole genome shotgun sequence",4,2.71087746359461e-06,4.1,2.78440095271935e-06
"1810504","Immundisolibacter cernigliae strain TR3.2 chromosome, complete genome",4,2.71087746359461e-06,5.4,3.68225298851913e-06
"1852378","Caecibacter massiliensis strain Marseille-P2974, whole genome shotgun sequence",4,2.71087746359461e-06,4.2,2.83814682786643e-06
"1871025","Ndongobacter massiliensis strain Marseille-P3170T chromosome contig00001",4,2.71087746359461e-06,3.2,2.20036383854496e-06
"273121","Wolinella succinogenes DSM 1740, complete sequence",3,2.03315809769596e-06,2.9,1.99757070305042e-06
"883","Desulfovibrio vulgaris str. 'Miyazaki F', complete sequence",3,2.03315809769596e-06,3,2.00951802788866e-06
"870187","Thiothrix nivea DSM 5205 Thiniscaffold_4, whole genome shotgun sequence",3,2.03315809769596e-06,3.6,2.45338964492448e-06
"160490","Streptococcus pyogenes M1 GAS, complete sequence",3,2.03315809769596e-06,3.1,2.13238736255548e-06
"862967","Streptococcus intermedius B196, complete sequence",3,2.03315809769596e-06,3.5,2.37952457789224e-06
"886882","Paenibacillus polymyxa SC2, complete sequence",3,2.03315809769596e-06,3.9,2.64500208632733e-06
"390333","Lactobacillus delbrueckii subsp. bulgaricus ATCC 11842 = JCM 1002, complete sequence",3,2.03315809769596e-06,3.2,2.18098490666089e-06
"930942","Ligilactobacillus animalis KCTC 3501 = DSM 20602 NODE_24, whole genome shotgun sequence",3,2.03315809769596e-06,3.1,2.09193352676231e-06
"1136179","Rhodococcus erythropolis CCM2595, complete sequence",3,2.03315809769596e-06,3.6,2.45432459119114e-06
"29314","Mycolicibacter hiberniae strain ATCC 49874 contig_16, whole genome shotgun sequence",3,2.03315809769596e-06,3.9,2.64844127544121e-06
"642492","Cellulosilyticum lentocellum DSM 5427, complete sequence",3,2.03315809769596e-06,3.1,2.11431211869801e-06
"29486","Yersinia ruckeri strain Big Creek 74 chromosome, complete genome",3,2.03315809769596e-06,3.1,2.12685123323518e-06
"1449976","Kutzneria albida DSM 43870 chromosome, complete genome",3,2.03315809769596e-06,3.2,2.14257473116794e-06
"1300150","Enterococcus mundtii QU 25, complete sequence",3,2.03315809769596e-06,3.3,2.21747055582362e-06
"59505","Actinotignum schaalii strain CCUG 27420 chromosome, complete genome",3,2.03315809769596e-06,2.8,1.91943471016645e-06
"1358411","Pantoea dispersa EGD-AAK13 contig38, whole genome shotgun sequence",3,2.03315809769596e-06,2.9,1.94709710539908e-06
"1423144","Phaeobacter gallaeciensis DSM 26640, complete sequence",3,2.03315809769596e-06,3,2.05923526553516e-06
"1035195","Corynebacterium durum F0235 Scfld1, whole genome shotgun sequence",3,2.03315809769596e-06,2.7,1.85796457709129e-06
"69373","Curtobacterium pusillum strain AA3 chromosome, complete genome",3,2.03315809769596e-06,2.7,1.79920497958952e-06
"1212764","Paenibacillus popilliae ATCC 14706, whole genome shotgun sequence",3,2.03315809769596e-06,3.1,2.13427761341509e-06
"1220594","Parageobacillus caldoxylosilyticus NBRC 107762, whole genome shotgun sequence",3,2.03315809769596e-06,3.3,2.24142319894088e-06
"1114943","Streptomyces tsukubensis NRRL18488 Contig843, whole genome shotgun sequence",3,2.03315809769596e-06,3.6,2.46510885266923e-06
"342108","Magnetospirillum magneticum AMB-1, complete sequence",3,2.03315809769596e-06,3,2.03344442948503e-06
"84531","Lysobacter antibioticus strain ATCC 29479 chromosome, complete genome",3,2.03315809769596e-06,3.1,2.12699919332635e-06
"154288","Turicibacter sanguinis strain 2789STDY5834851, whole genome shotgun sequence",3,2.03315809769596e-06,2.8,1.90180978222815e-06
"698762","Thermanaeromonas toyohensis ToBE chromosome I",3,2.03315809769596e-06,5,3.39413728230781e-06
"163359","Acidiferrobacter thiooxydans strain ZJ Contig_36, whole genome shotgun sequence",3,2.03315809769596e-06,3,2.00084271097108e-06
"1050201","Allobaculum stercoricanis DSM 13633 AllstDRAFT_scaffold1.1, whole genome shotgun sequence",3,2.03315809769596e-06,3.1,2.11523336288181e-06
"867903","Thermaerobacter subterraneus DSM 13965 ThesuDRAFT_TSB.2, whole genome shotgun sequence",3,2.03315809769596e-06,3.4,2.3141590746565e-06
"198092","Roseomonas rosea strain DSM 14916, whole genome shotgun sequence",3,2.03315809769596e-06,2.7,1.80685950080525e-06
"1399795","Williamsoniiplasma somnilux ATCC 49194 P693DRAFT_scaffold00003.3_C, whole genome shotgun sequence",3,2.03315809769596e-06,3.1,2.07657440893846e-06
"1120975","Alkalibacter saccharofermentans DSM 14828, whole genome shotgun sequence",3,2.03315809769596e-06,3.1,2.06774453690605e-06
"237682","Salinibacillus kushneri strain CGMCC 1.3566, whole genome shotgun sequence",3,2.03315809769596e-06,3.4,2.30197678552398e-06
"446470","Stackebrandtia nassauensis DSM 44728, complete sequence",3,2.03315809769596e-06,2.7,1.84541593546238e-06
"292800","Flavonifractor plautii strain YL31 chromosome, complete genome",3,2.03315809769596e-06,3,2.01643968446711e-06
"888062","Dialister micraerophilus DSM 19965 SCAFFOLD3, whole genome shotgun sequence",3,2.03315809769596e-06,3,2.00061672735074e-06
"320497","Neoasaia chiangmaiensis strain NBRC 101099 chromosome, complete genome",3,2.03315809769596e-06,2.2,1.49535339342667e-06
"1123262","Solirubrobacter soli DSM 22325 G569DRAFT_scaffold00014.14_C, whole genome shotgun sequence",3,2.03315809769596e-06,3.1,2.0971959507156e-06
"364197","Pseudomonas pohangensis strain DSM 17875 chromosome I",3,2.03315809769596e-06,3.8,2.56158510476178e-06
"1423734","Agrilactobacillus composti DSM 18527 = JCM 14202, whole genome shotgun sequence",3,2.03315809769596e-06,2.5,1.69653301951667e-06
"401472","Corynebacterium ureicelerivorans strain IMMIB RIV-2301 chromosome, complete genome",3,2.03315809769596e-06,3.9,2.62506198500696e-06
"445709","Pandoraea thiooxydans strain ATSB16 chromosome, complete genome",3,2.03315809769596e-06,3.1,2.07714423384456e-06
"454194","Pyrinomonas methylaliphatogenes strain K22, whole genome shotgun sequence",3,2.03315809769596e-06,3,2.0351089672949e-06
"544580","Actinomyces oris strain T14V chromosome, complete genome",3,2.03315809769596e-06,3.2,2.14065465464212e-06
"1255705","Bavariicoccus seileri WCC 4188 strain DSM 19936 H541DRAFT_scaffold00106.106_C, whole genome shotgun sequence",3,2.03315809769596e-06,3.3,2.26721223403806e-06
"574349","Aidingimonas halophila strain DSM 19219, whole genome shotgun sequence",3,2.03315809769596e-06,3.3,2.2284860466578e-06
"582672","Methylobacterium phyllostachyos strain BL47, whole genome shotgun sequence",3,2.03315809769596e-06,3.5,2.38842084057975e-06
"589382","Agromyces flavus strain CPCC 202695 chromosome I",3,2.03315809769596e-06,2.9,1.98060618241442e-06
"665550","Dietzia alimentaria strain BP 27/1 BP27/1_c60_length_15841_cov_411.133, whole genome shotgun sequence",3,2.03315809769596e-06,3.6,2.40905086946528e-06
"1230338","Moraxella macacae 0408225 strain 408225 chrom_contig1, whole genome shotgun sequence",3,2.03315809769596e-06,3.8,2.5786655507574e-06
"857252","Halopseudomonas aestusnigri strain VGXO14 scaffold00028, whole genome shotgun sequence",3,2.03315809769596e-06,2.5,1.72532049799376e-06
"909625","Rubrobacter aplysinae strain RV113 contig8_size148475, whole genome shotgun sequence",3,2.03315809769596e-06,3.1,2.07932517537864e-06
"946333","Rhizobacter gummiphilus strain NS21 chromosome, complete genome",3,2.03315809769596e-06,2.8,1.90253276229345e-06
"1118379","Mycolicibacter minnesotensis strain DSM 45633 NODE_10_length_125427_cov_81.3068, whole genome shotgun sequence",3,2.03315809769596e-06,3.2,2.13587538449561e-06
"1134413","Halalkalibacterium ligniniphilum strain L1 contig139, whole genome shotgun sequence",3,2.03315809769596e-06,3.2,2.14390955448667e-06
"1161401","Euryhalocaulis caribicus strain JL2009 contig00004, whole genome shotgun sequence",3,2.03315809769596e-06,3,2.03333193449464e-06
"1245526","Pseudomonas guangdongensis strain CCTCC AB 2012022 chromosome I",3,2.03315809769596e-06,2.7,1.84347450874323e-06
"1215343","Liberibacter crescens BT-1, complete sequence",3,2.03315809769596e-06,2.7,1.82562716499247e-06
"1332080","Sphingobium baderi strain DE-13 chromosome, complete genome",3,2.03315809769596e-06,3.6,2.41051883975137e-06
"1379270","Gemmatimonas phototrophica strain AP64 chromosome, complete genome",3,2.03315809769596e-06,3.7,2.47908943273484e-06
"1484693","Rhodoferax saidenbachensis strain DSM 22694 chromosome, complete genome",3,2.03315809769596e-06,3,2.03602900615018e-06
"1150474","Mesoaciditoga lauensis cd-1655R = DSM 25116 EK18DRAFT_scaffold00029.29_C, whole genome shotgun sequence",3,2.03315809769596e-06,3.5,2.38272223378296e-06
"267608","Ralstonia solanacearum GMI1000, complete sequence",2,1.3554387317973e-06,2.4,1.60765714162073e-06
"1351754","Avibacterium paragallinarum JF4211, whole genome shotgun sequence",2,1.3554387317973e-06,2.4,1.65013497347083e-06
"901","Desulfovibrio piger strain FI11049 isolate FI11049 chromosome I, complete sequence",2,1.3554387317973e-06,2,1.36277820921977e-06
"349124","Halorhodospira halophila SL1, complete sequence",2,1.3554387317973e-06,1.9,1.31089524040251e-06
"316058","Rhodopseudomonas palustris HaA2, complete sequence",2,1.3554387317973e-06,2.3,1.55075789359621e-06
"1349773","Micrococcus lylae NBRC 15355, whole genome shotgun sequence",2,1.3554387317973e-06,2.2,1.47054277125403e-06
"279808","Staphylococcus haemolyticus JCSC1435, complete sequence",2,1.3554387317973e-06,2.1,1.43807317642113e-06
"862971","Streptococcus anginosus C238, complete sequence",2,1.3554387317973e-06,2,1.38904033985147e-06
"1174504","Peribacillus psychrosaccharolyticus ATCC 23296 Contig107, whole genome shotgun sequence",2,1.3554387317973e-06,2,1.36183812348865e-06
"1476","Sporosarcina psychrophila strain DSM 6497 chromosome, complete genome",2,1.3554387317973e-06,2.2,1.50880486462854e-06
"1482","Virgibacillus halodenitrificans strain PDB-F2 chromosome, complete genome",2,1.3554387317973e-06,2,1.38775226362888e-06
"999413","[Clostridium] innocuum 2959 acBRf-supercont1.1, whole genome shotgun sequence",2,1.3554387317973e-06,1.9,1.31774676768183e-06
"1601","Ligilactobacillus agilis strain La3 chromosome, complete genome",2,1.3554387317973e-06,2.5,1.70101499324555e-06
"702459","Bifidobacterium bifidum PRL2010, complete sequence",2,1.3554387317973e-06,1.9,1.31324590405553e-06
"1703","Brevibacterium linens strain BS258 chromosome, complete genome",2,1.3554387317973e-06,1.3,8.47704392526255e-07
"1131442","Mycobacterium marinum E11 chromosome 1, complete sequence",2,1.3554387317973e-06,2.3,1.571504655127e-06
"1265310","Mycobacterium asiaticum DSM 44297, whole genome shotgun sequence",2,1.3554387317973e-06,2.4,1.63779190396827e-06
"1793","Mycolicibacterium fallax strain DSM 44179 contig_66, whole genome shotgun sequence",2,1.3554387317973e-06,2.4,1.61854016461625e-06
"2026","Thermoactinomyces vulgaris strain NRRL F-5595 F5595contig1021.1, whole genome shotgun sequence",2,1.3554387317973e-06,2,1.34701728644774e-06
"2074","Pseudonocardia autotrophica strain NRRL B-16064 contig75.1, whole genome shotgun sequence",2,1.3554387317973e-06,1.8,1.21506231771696e-06
"1009370","Acetonema longum DSM 6540 Contig00111, whole genome shotgun sequence",2,1.3554387317973e-06,2,1.32915703565134e-06
"1255619","Vagococcus fluvialis bH819, whole genome shotgun sequence",2,1.3554387317973e-06,1.9,1.28078638454027e-06
"1449338","Carnobacterium gallinarum DSM 4847 strain MT44 BR43DRAFT_scf7180000000012_quiver.5_C, whole genome shotgun sequence",2,1.3554387317973e-06,2.3,1.55903911025103e-06
"1449342","Carnobacterium mobile DSM 4848 strain MT37L BR87DRAFT_scf7180000000018_quiver_dupTrim_8950.1_C, whole genome shotgun sequence",2,1.3554387317973e-06,2.4,1.64101550328766e-06
"931626","Acetobacterium woodii DSM 1030, complete sequence",2,1.3554387317973e-06,2,1.32867931895582e-06
"1423892","Ehrlichia muris AS145, complete sequence",2,1.3554387317973e-06,1.6,1.05717651811505e-06
"1246476","Arthrobacter crystallopoietes BAB-32 contig28, whole genome shotgun sequence",2,1.3554387317973e-06,2,1.34316025153617e-06
"44577","Nitrosomonas ureae strain Nm10 chromosome, complete genome",2,1.3554387317973e-06,2,1.37918259400966e-06
"1231350","Acidisphaera rubrifaciens HS-AP3, whole genome shotgun sequence",2,1.3554387317973e-06,2.5,1.6849560009579e-06
"945021","Tetragenococcus halophilus NBRC 12172, complete sequence",2,1.3554387317973e-06,2.9,1.98842005298478e-06
"880072","Desulfobacca acetoxidans DSM 11109, complete sequence",2,1.3554387317973e-06,2.8,1.88050462044696e-06
"868864","Desulfurobacterium thermolithotrophum DSM 11699, complete sequence",2,1.3554387317973e-06,2,1.35545484520997e-06
"1123016","Stutzerimonas balearica DSM 6083 strain DSM6083 (=SP1402) chromosome, complete genome",2,1.3554387317973e-06,2.7,1.84614206871236e-06
"1121871","Eremococcus coleocola DSM 15696 G396DRAFT_scaffold00048.48_C, whole genome shotgun sequence",2,1.3554387317973e-06,2.4,1.62197417612135e-06
"92947","Ketogulonicigenium robustum strain SPU_B003 chromosome, complete genome",2,1.3554387317973e-06,2.9,1.98884374398732e-06
"1193181","Phycicoccus elongatus Lp2, whole genome shotgun sequence",2,1.3554387317973e-06,2.2,1.46118289754939e-06
"1123301","Streptococcus didelphis DSM 15616 A3GUDRAFT_scaffold_11.12, whole genome shotgun sequence",2,1.3554387317973e-06,2.2,1.48143078422859e-06
"1123311","Streptococcus orisratti DSM 15617 A3I7DRAFT_scaffold_69.70, whole genome shotgun sequence",2,1.3554387317973e-06,2.1,1.43537133161809e-06
"1348334","Lyngbya aestuarii BL J laest3.contig.5, whole genome shotgun sequence",2,1.3554387317973e-06,2,1.35544831947469e-06
"266940","Kineococcus radiotolerans SRS30216 = ATCC BAA-149, complete sequence",2,1.3554387317973e-06,2.1,1.39116272241875e-06
"1217658","Acinetobacter gyllenbergii NIPH 230 adfcq-supercont1.2, whole genome shotgun sequence",2,1.3554387317973e-06,2.5,1.67876324793424e-06
"141349","Mycobacterium lentiflavum strain CSUR P1491, whole genome shotgun sequence",2,1.3554387317973e-06,2.4,1.63291633490487e-06
"1158610","Enterococcus phoeniculicola ATCC BAA-412 acOtz-supercont2.2, whole genome shotgun sequence",2,1.3554387317973e-06,2.1,1.45084594369474e-06
"1122237","Microbacterium gubbeenense DSM 15944 G510DRAFT_scaffold00012.12_C, whole genome shotgun sequence",2,1.3554387317973e-06,2,1.35558604489236e-06
"445972","Anaerotruncus colihominis DSM 17241 Scfld_02_24, whole genome shotgun sequence",2,1.3554387317973e-06,2.5,1.6974098602459e-06
"170573","Staphylococcus pettenkoferi strain FDAARGOS_288 chromosome, complete genome",2,1.3554387317973e-06,2.1,1.42113764546885e-06
"204773","Herminiimonas arsenicoxydans chromosome, complete sequence",2,1.3554387317973e-06,2.2,1.45966460605931e-06
"1121918","Geopsychrobacter electrodiphilus DSM 16401 D888DRAFT_scaffold00001.1_C, whole genome shotgun sequence",2,1.3554387317973e-06,2.1,1.3894897082479e-06
"857290","Scardovia wiggsiae F0424 cont1.1, whole genome shotgun sequence",2,1.3554387317973e-06,2.4,1.65727293317919e-06
"1423811","Companilactobacillus tucceti DSM 20183 Scaffold33, whole genome shotgun sequence",2,1.3554387317973e-06,2,1.36234769758903e-06
"261164","Psychrobacter alimentarius strain PAMC 27889 chromosome, complete genome",2,1.3554387317973e-06,2.1,1.44332934954524e-06
"265719","Aquimonas voraii strain DSM 16957, whole genome shotgun sequence",2,1.3554387317973e-06,2.4,1.60215904709446e-06
"582744","Methylovorus glucosetrophus SIP3-4, complete sequence",2,1.3554387317973e-06,3.4,2.28426252995912e-06
"1121019","Arthrobacter castelli DSM 16402 H535DRAFT_scaffold00007.7_C, whole genome shotgun sequence",2,1.3554387317973e-06,1.7,1.17843316409602e-06
"279113","Collimonas pratensis strain Ter91 chromosome, complete genome",2,1.3554387317973e-06,2,1.37575424820744e-06
"284581","Priestia koreensis strain DSM 16467 Contig9, whole genome shotgun sequence",2,1.3554387317973e-06,2,1.36652167782991e-06
"1255656","Agrococcus casei LMG 22410, whole genome shotgun sequence",2,1.3554387317973e-06,2.1,1.3966302860848e-06
"983920","Novosphingobium nitrogenifigens DSM 19370 scaffold00012, whole genome shotgun sequence",2,1.3554387317973e-06,1.8,1.22128378963641e-06
"1423750","Liquorilactobacillus ghanensis DSM 18630 NODE_31, whole genome shotgun sequence",2,1.3554387317973e-06,2.2,1.46916118473502e-06
"521098","Alicyclobacillus acidocaldarius subsp. acidocaldarius DSM 446, complete sequence",2,1.3554387317973e-06,1.8,1.23837697583663e-06
"405559","Paracoccus saliphilus strain DSM 18447, whole genome shotgun sequence",2,1.3554387317973e-06,2.1,1.39899270648405e-06
"1123267","Sphingomonas astaxanthinifaciens DSM 22298 BS69DRAFT_scaffold00001.1_C, whole genome shotgun sequence",2,1.3554387317973e-06,1.9,1.31520980538886e-06
"415747","Thiohalomonas denitrificans strain HLD2, whole genome shotgun sequence",2,1.3554387317973e-06,2.1,1.43661358572548e-06
"438855","Methylomarinum vadi strain IT-4 EP25DRAFT_scf7180000000004_quiver.1_C, whole genome shotgun sequence",2,1.3554387317973e-06,2.5,1.66766001032007e-06
"1300347","Nocardioides dokdonensis FR1436 chromosome, complete genome",2,1.3554387317973e-06,2.3,1.58959063305178e-06
"472569","Devriesea agamarum strain IMP2 chromosome I",2,1.3554387317973e-06,1.7,1.14403095496766e-06
"1127673","Aliiglaciecola lipolytica E3, whole genome shotgun sequence",2,1.3554387317973e-06,2,1.36071997611681e-06
"1121020","Haematomicrobium sanguinis DSM 21259 O148DRAFT_scaffold00008.8_C, whole genome shotgun sequence",2,1.3554387317973e-06,2.3,1.5286807730058e-06
"1122612","Novosphingobium acidiphilum DSM 19966 G404DRAFT_scaffold00044.44_C, whole genome shotgun sequence",2,1.3554387317973e-06,1.5,9.94694502354772e-07
"1288826","Marinobacter santoriniensis NKSG1 contig00002, whole genome shotgun sequence",2,1.3554387317973e-06,2,1.34462430253342e-06
"529884","Rhodoluna lacicola strain MWH-Ta8 chromosome, complete genome",2,1.3554387317973e-06,2.2,1.48126080382121e-06
"571915","Corynebacterium mustelae strain DSM 45274 chromosome, complete genome",2,1.3554387317973e-06,1.3,9.12433421807514e-07
"1196031","Cytobacillus oceanisediminis 2691 chromosome, complete genome",2,1.3554387317973e-06,2.4,1.61275822458592e-06
"696762","Planktotalea frisia strain SH6-1 PFRI_contig000056, whole genome shotgun sequence",2,1.3554387317973e-06,2,1.33896808335716e-06
"754476","Methylophaga nitratireducenticrescens, complete sequence",2,1.3554387317973e-06,2.7,1.82277019099469e-06
"758825","Rugamonas rubra strain ATCC 43154, whole genome shotgun sequence",2,1.3554387317973e-06,2.1,1.4066991563745e-06
"863921","Gilvimarinus polysaccharolyticus strain YN3 Scaffold2, whole genome shotgun sequence",2,1.3554387317973e-06,1.8,1.23688444413549e-06
"870242","Carboxydothermus pertinax strain Ug1, whole genome shotgun sequence",2,1.3554387317973e-06,2,1.36472060118651e-06
"930117","Ornithinibacillus halophilus strain IBRC-M 10683, whole genome shotgun sequence",2,1.3554387317973e-06,2,1.35879305842241e-06
"1265845","Listeria weihenstephanensis FSL R9-0317 rep_c64, whole genome shotgun sequence",2,1.3554387317973e-06,2.5,1.69930237307521e-06
"1036780","Bosea robiniae strain DSM 26672, whole genome shotgun sequence",2,1.3554387317973e-06,2.1,1.4510165054958e-06
"1225786","Dickeya solani IPO 2222 chromosome, complete genome",2,1.3554387317973e-06,2.3,1.55154474950867e-06
"1101373","Tepidimonas fonticaldi strain PL17 contig_1, whole genome shotgun sequence",2,1.3554387317973e-06,2.4,1.64348084922734e-06
"570952","Fodinicurvata sediminis DSM 21159 G502DRAFT_scaffold00005.5_C, whole genome shotgun sequence",2,1.3554387317973e-06,2,1.37879511998867e-06
"1137993","Geodermatophilus africanus strain DSM 45422, whole genome shotgun sequence",2,1.3554387317973e-06,1.9,1.26897321450266e-06
"1218508","Bombilactobacillus mellis strain Hon2 Hon2_scaffold4, whole genome shotgun sequence",2,1.3554387317973e-06,2.4,1.63769261071665e-06
"1437875","Corynebacterium frankenforstense DSM 45800 strain ST18 chromosome, complete genome",2,1.3554387317973e-06,3,2.06694348150083e-06
"1232429","Nesterenkonia massiliensis strain NP1, whole genome shotgun sequence",2,1.3554387317973e-06,2.1,1.41726414866153e-06
"1247024","Arsenophonus endosymbiont str. Hangzhou of Nilaparvata lugens strain Hangzhou contig6, whole genome shotgun sequence",2,1.3554387317973e-06,2,1.38240337618506e-06
"1323370","Caloranaerobacter ferrireducens strain DY22619 contig22, whole genome shotgun sequence",2,1.3554387317973e-06,2.1,1.44470575555353e-06
"1330700","Thermus caliditerrae strain YIM 77777 EI72DRAFT_scf7180000000016_quiver.3_C, whole genome shotgun sequence",2,1.3554387317973e-06,2.2,1.52120836790083e-06
"1522309","Flaviflexus massiliensis strain SIT4, whole genome shotgun sequence",2,1.3554387317973e-06,2,1.35687698063017e-06
"1702221","Faecalibaculum rodentium strain ALO17 chromosome, complete genome",2,1.3554387317973e-06,2.6,1.78507500784287e-06
"1750561","Legionella saoudiensis strain LS-1, whole genome shotgun sequence",2,1.3554387317973e-06,2.3,1.58490838444923e-06
"1852380","Corynebacterium urinipleomorphum strain Marseille-P2799T, whole genome shotgun sequence",2,1.3554387317973e-06,2.5,1.69973131398794e-06
"1857645","Actinomyces vulturis strain VUL7 Scaffold8_1, whole genome shotgun sequence",2,1.3554387317973e-06,2.2,1.50567434267609e-06
"1871035","Negativibacillus massiliensis strain Marseille-P3213T, whole genome shotgun sequence",2,1.3554387317973e-06,1.8,1.22143472798959e-06
"1921010","Mariprofundus micogutta strain ET2, whole genome shotgun sequence",2,1.3554387317973e-06,1.9,1.2732097071473e-06
"2054173","Candidatus Coxiella mudrowiae strain CRt chromosome, complete genome",2,1.3554387317973e-06,2,1.36611367215866e-06
"593907","Cellulomonas gilvus ATCC 13127, complete sequence",1,6.77719365898652e-07,1,6.87302154447366e-07
"31967","Phenylobacterium immobile (ATCC 35973) strain (strain E), whole genome shotgun sequence",1,6.77719365898652e-07,1,6.85104718964892e-07
"192","Azospirillum brasilense strain Sp 7 chromosome, complete genome",1,6.77719365898652e-07,1,6.86908553627458e-07
"208964","Pseudomonas aeruginosa PAO1, complete genome",1,6.77719365898652e-07,1.1,7.25408809164333e-07
"380703","Aeromonas hydrophila subsp. hydrophila ATCC 7966, complete sequence",1,6.77719365898652e-07,1,7.03180802451406e-07
"254945","Ehrlichia ruminantium str. Welgevonden, complete sequence",1,6.77719365898652e-07,1.5,1.02161123057247e-06
"882","Desulfovibrio vulgaris str. Hildenborough, complete sequence",1,6.77719365898652e-07,1.1,7.30467310661116e-07
"897","Desulfococcus multivorans strain DSM 2059 chromosome, complete genome",1,6.77719365898652e-07,1,6.84249372148568e-07
"643867","Marivirga tractuosa DSM 4126, complete sequence",1,6.77719365898652e-07,1,6.77726068380973e-07
"1089552","Rhodovibrio salinarum DSM 9154 RHOSADRAFT_scaffold1.1, whole genome shotgun sequence",1,6.77719365898652e-07,1,6.82413339640824e-07
"317619","Prochlorothrix hollandica PCC 9006 = CALU 1027 strain PCC 9006 Pro9006DRAFT_Contig3.7, whole genome shotgun sequence",1,6.77719365898652e-07,1,6.77771615301119e-07
"1410671","Ruminococcus flavefaciens MC2020 T490DRAFT_scaffold00016.16_C, whole genome shotgun sequence",1,6.77719365898652e-07,1,6.78310125073049e-07
"568814","Streptococcus suis BM407, complete sequence",1,6.77719365898652e-07,0.9,6.25365257258255e-07
"333849","Enterococcus faecium DO, complete sequence",1,6.77719365898652e-07,1.1,7.48207061609048e-07
"1236954","Caldalkalibacillus mannanilyticus JCM 10596, whole genome shotgun sequence",1,6.77719365898652e-07,1,6.79099126152095e-07
"698758","Amphibacillus xylanus NBRC 15112, complete sequence",1,6.77719365898652e-07,1,7.02459928071249e-07
"935198","Clostridium botulinum B str. Eklund 17B (NRP), complete sequence",1,6.77719365898652e-07,1,6.93324748583367e-07
"1533","Clostridium fallax strain DSM 2631, whole genome shotgun sequence",1,6.77719365898652e-07,1,6.77154137199094e-07
"1128398","Gottschalkia acidurici 9a, complete sequence",1,6.77719365898652e-07,1,6.94060322113374e-07
"650150","Erysipelothrix rhusiopathiae str. Fujisawa, complete sequence",1,6.77719365898652e-07,1,6.97434024721985e-07
"518634","Bifidobacterium breve DSM 20213 = JCM 1192 chromosome, complete genome",1,6.77719365898652e-07,1,6.84179345058739e-07
"1710","Cellulosimicrobium cellulans strain JZ5 J5_S3.NODE_205, whole genome shotgun sequence",1,6.77719365898652e-07,1,7.10995720528083e-07
"1286171","Peptoclostridium acidaminophilum DSM 3953 strain al-2 chromosome, complete genome",1,6.77719365898652e-07,1.1,7.55252494500113e-07
"1780","Mycobacterium malmoense strain IP1130001 NODE_16_length_116681_cov_55.8919, whole genome shotgun sequence",1,6.77719365898652e-07,0.9,5.93455707495367e-07
"1848","Pseudonocardia thermophila strain DSM 43832, whole genome shotgun sequence",1,6.77719365898652e-07,1,7.05635497055492e-07
"526225","Geodermatophilus obscurus DSM 43160, complete sequence",1,6.77719365898652e-07,1.1,7.52928000503916e-07
"879212","Desulfobacter postgatei 2ac9 chromosome, whole genome shotgun sequence",1,6.77719365898652e-07,1,6.77794003340778e-07
"381764","Fervidobacterium nodosum Rt17-B1, complete sequence",1,6.77719365898652e-07,1,7.00126000244923e-07
"28445","Mycobacterium intermedium strain DSM 44049 NODE_118_length_15743_cov_21.5076, whole genome shotgun sequence",1,6.77719365898652e-07,1.3,8.97373545665977e-07
"1212545","Staphylococcus arlettae CVD059 SARL_c56, whole genome shotgun sequence",1,6.77719365898652e-07,1,6.86599809769106e-07
"232089","Agromyces cerinus subsp. cerinus strain DSM 8595, whole genome shotgun sequence",1,6.77719365898652e-07,1.1,7.6390011979146e-07
"33895","Mycobacterium interjectum strain ATCC 51457T, whole genome shotgun sequence",1,6.77719365898652e-07,1.1,7.23915402606424e-07
