"TaxonomyID","Genome","read_count","Proportion","readsEM","EMProportion"
"1917864","Indiicoccus explosivorum isolate S5-TSA-19 S5TSA19.ioncontig_57, whole genome shotgun sequence",1,1.66950482486894e-05,1.2,1.96554965419721e-05
"648782","Ruania alba strain DSM 21368, whole genome shotgun sequence",1,1.66950482486894e-05,1,1.70944162773913e-05
"683354","Candidimonas nitroreducens strain SC-089 Scaffold14_2, whole genome shotgun sequence",1,1.66950482486894e-05,1,1.68832911128033e-05
"758825","Rugamonas rubra strain ATCC 43154, whole genome shotgun sequence",1,1.66950482486894e-05,1,1.66982659930566e-05
"1230338","Moraxella macacae 0408225 strain 408225 chrom_contig1, whole genome shotgun sequence",1,1.66950482486894e-05,1,1.67656409879108e-05
"766136","Desulfuribacillus alkaliarsenatis strain AHT28 DSM-24608_Contig_27_85X, whole genome shotgun sequence",1,1.66950482486894e-05,1.2,1.94620886379762e-05
"1238182","Caenispirillum salinarum AK4 contig23, whole genome shotgun sequence",1,1.66950482486894e-05,1,1.72040608081586e-05
"889306","Jeotgalibacillus soli strain P9 contig00001, whole genome shotgun sequence",1,1.66950482486894e-05,1,1.60074257047428e-05
"930128","Alteribacillus iranensis strain DSM 23995, whole genome shotgun sequence",1,1.66950482486894e-05,1.1,1.76769126647781e-05
"1033741","Microvirga massiliensis strain JC119, whole genome shotgun sequence",1,1.66950482486894e-05,0.7,1.14865496255129e-05
"1045773","Arthrobacter cupressi strain CGMCC 1.10783, whole genome shotgun sequence",1,1.66950482486894e-05,1,1.70222445929112e-05
"1045775","Paenibacillus catalpae strain CGMCC 1.10784, whole genome shotgun sequence",1,1.66950482486894e-05,1.2,2.03643549201797e-05
"1048340","Marininema mesophilum strain DSM 45610, whole genome shotgun sequence",1,1.66950482486894e-05,0.5,8.76721947931457e-06
"1338011","Elizabethkingia anophelis NUHP1 chromosome, complete genome",1,1.66950482486894e-05,1,1.67275308952446e-05
"1637645","Limnoraphis robusta CS-951 contig182, whole genome shotgun sequence",1,1.66950482486894e-05,1,1.66972772421165e-05
"570952","Fodinicurvata sediminis DSM 21159 G502DRAFT_scaffold00005.5_C, whole genome shotgun sequence",1,1.66950482486894e-05,1,1.66835388137445e-05
"1122252","Marinospirillum celere strain DSM 18438, whole genome shotgun sequence",1,1.66950482486894e-05,1,1.69518084832053e-05
"1231336","Schleiferilactobacillus shenzhenensis LY-73 LY73.Scaffold52, whole genome shotgun sequence",1,1.66950482486894e-05,1,1.67261237619095e-05
"1246637","Desulfamplus magnetovallimortis isolate PRJEB14757, whole genome shotgun sequence",1,1.66950482486894e-05,1,1.66946711866533e-05
"1247024","Arsenophonus endosymbiont str. Hangzhou of Nilaparvata lugens strain Hangzhou contig6, whole genome shotgun sequence",1,1.66950482486894e-05,1.4,2.36933988207252e-05
"1293573","Aquitalea pelogenes strain CCM 7557 contig_108, whole genome shotgun sequence",1,1.66950482486894e-05,1,1.73020824116721e-05
"1302690","Cnuella takakiae strain RG1-1 Scaffold1, whole genome shotgun sequence",1,1.66950482486894e-05,1.1,1.87262949187166e-05
"1323361","Prescottella defluvii strain Ca11 contig058, whole genome shotgun sequence",1,1.66950482486894e-05,1.1,1.81293528915799e-05
"948458","Actinotalea ferrariae CF5-4 contig368, whole genome shotgun sequence",1,1.66950482486894e-05,1,1.67269155798554e-05
"1396821","Ectothiorhodospira marina strain DSM 241, whole genome shotgun sequence",1,1.66950482486894e-05,1,1.69092600371441e-05
"1437453","Streptomyces leeuwenhoekii strain type strain (C34 = DSM 42122 = NRRL B-24963) chromosome 1",1,1.66950482486894e-05,1.1,1.76704233981137e-05
"1464122","Alkalihalobacillus lonarensis strain 25nlg, whole genome shotgun sequence",1,1.66950482486894e-05,1,1.68134556037494e-05
"1211819","Holdemania massiliensis AP2, whole genome shotgun sequence",1,1.66950482486894e-05,1,1.67564101271276e-05
"1185767","Zunongwangia atlantica 22II14-10F7 contig62, whole genome shotgun sequence",1,1.66950482486894e-05,0.5,9.07035099249606e-06
"1513271","Catenovulum maritimum strain Q1 scaffold41, whole genome shotgun sequence",1,1.66950482486894e-05,1,1.66954047577706e-05
"1515612","Sphingopyxis fribergensis strain Kp5.2 chromosome, complete genome",1,1.66950482486894e-05,2.1,3.50630336454392e-05
"1522317","Nigerium massiliense strain SIT7, whole genome shotgun sequence",1,1.66950482486894e-05,1.2,1.94667867988487e-05
"1547597","Sanguibacteroides justesenii strain OUH 308042 contig12, whole genome shotgun sequence",1,1.66950482486894e-05,1.1,1.81657232248861e-05
"1548207","Cephaloticoccus primus strain CAG34 contig_10, whole genome shotgun sequence",1,1.66950482486894e-05,0.5,8.48796968308844e-06
"1612308","Methylocapsa palsarum strain NE2, whole genome shotgun sequence",1,1.66950482486894e-05,0.8,1.35022806944859e-05
"1703339","Croceicoccus mobilis strain Ery22 Ery22_C19, whole genome shotgun sequence",1,1.66950482486894e-05,1.1,1.78603844543383e-05
"1708715","Ensifer aridi strain TW10 SinTW10DRAFT_scaffold_5.6_C, whole genome shotgun sequence",1,1.66950482486894e-05,0.9,1.52444702403421e-05
"1776391","Romboutsia timonensis strain Marseille-P326, whole genome shotgun sequence",1,1.66950482486894e-05,1.1,1.77773779252093e-05
"1618023","Aliterella atlantica CENA595 contig_10982, whole genome shotgun sequence",1,1.66950482486894e-05,1,1.67836755154279e-05
"1855823","Macrococcus canis strain KM 45013 chromosome, complete genome",1,1.66950482486894e-05,1.4,2.38112804465004e-05
"1871029","Intestinibacillus massiliensis strain Marseille-P3216T, whole genome shotgun sequence",1,1.66950482486894e-05,1,1.74925390201536e-05
"1903263","Traorella massiliensis strain Marseille-P3110T, whole genome shotgun sequence",1,1.66950482486894e-05,0.9,1.42507174253688e-05
