"TaxonomyID","Genome","read_count","Proportion","readsEM","EMProportion"
"29433","Moraxella ovis strain 199/55 chromosome, complete genome",21879,0.386022795440912,21627.5,0.381585620602578
"883103","Dolosigranulum pigrum ATCC 51524 supercont1.1, whole genome shotgun sequence",17935,0.316436712657469,17927.2,0.316299645606908
"1121368","Corynebacterium pseudodiphtheriticum DSM 44287 O146DRAFT_scaffold00012.12_C, whole genome shotgun sequence",6415,0.1131832457038,6416.5,0.113209495036031
"573983","Moraxella porci DSM 25326 strain CCUG 54912 54912T_ctg_0000016, whole genome shotgun sequence",2598,0.0458378912452804,2854.1,0.0503568389520403
"176280","Staphylococcus epidermidis ATCC 12228, complete sequence",2439,0.0430325699565969,2383.7,0.0420572127960334
"753702","Alkalibacterium subtropicum strain DSM 23664, whole genome shotgun sequence",1588,0.0280179258265994,1590.7,0.0280647198181596
"525260","Corynebacterium accolens ATCC 49725 SCAFFOLD5, whole genome shotgun sequence",952,0.0167966406718656,933,0.0164610406842002
"279808","Staphylococcus haemolyticus JCSC1435, complete sequence",842,0.01485585235894,896,0.0158085463061814
"883081","Alloiococcus otitis ATCC 51267 supercont1.2, whole genome shotgun sequence",130,0.00229365891527577,133.9,0.00236269463745877
"498211","Cellvibrio japonicus Ueda107, complete sequence",129,0.00227601538515826,124.4,0.00219466327719209
"1121354","Corynebacterium capitovis DSM 44611 A3E3DRAFT_scaffold00005.5_C, whole genome shotgun sequence",120,0.00211722361410071,135.9,0.0023977099375216
"393763","Anaerobacillus alkalilacustris strain DSM 18345 Ga0137925_101, whole genome shotgun sequence",96,0.00169377889128057,95.4,0.00168345009631665
"1367847","Paracoccus aminophilus JCM 7686, complete sequence",90,0.00158791771057553,88.8,0.00156629776327293
"316","Stutzerimonas stutzeri, complete sequence",67,0.0011821165178729,65.8,0.00116043304534435
"883111","Facklamia hominis CCUG 36813 supercont1.1, whole genome shotgun sequence",57,0.00100568121669784,50.6,0.00089295631004991
"427920","Alkalihalobacterium alkalinitrilicum strain DSM 22532 Scaffold1, whole genome shotgun sequence",52,0.000917463566110307,53.2,0.000939220382754355
"171101","Streptococcus pneumoniae R6, complete sequence",46,0.000811602385405272,47.2,0.000832815984479284
"419475","Brucella pseudogrignonensis strain K8 chromosome 1, complete sequence",40,0.000705741204700236,36.7,0.000648096655609744
"1284","Staphylococcus hyicus strain ATCC 11249 chromosome, complete genome",39,0.000688097674582731,38.7,0.000683547489549847
"574650","Micrococcus terreus strain CGMCC 1.7054, whole genome shotgun sequence",37,0.000652810614347719,34.6,0.000610840909765263
"872970","Amphibacillus marinus strain CGMCC 1.10434, whole genome shotgun sequence",34,0.000599880023995201,36.8,0.000648786523166195
"709510","Jeotgalicoccus aerolatus strain CGMCC 1.8911, whole genome shotgun sequence",33,0.000582236493877695,32.1,0.000567171146951759
"70584","Aquabacterium parvum strain B6 contig000030, whole genome shotgun sequence",30,0.000529305903525177,30.2,0.000532375340254932
"160488","Pseudomonas putida KT2440, complete sequence",29,0.000511662373407671,28.9,0.000510503227184291
"34060","Moraxella caviae strain CCUG 355 355T_ctg_0000060, whole genome shotgun sequence",29,0.000511662373407671,29.2,0.00051585640403569
"398578","Delftia acidovorans SPH-1, complete sequence",29,0.000511662373407671,28.7,0.000506744466555348
"224308","Bacillus subtilis subsp. subtilis str. 168 complete genome",28,0.000494018843290165,24.1,0.000425190636523471
"634430","Sphingomonas rubra strain CGMCC 1.9113, whole genome shotgun sequence",26,0.000458731783055154,25.3,0.000445850777740142
"936154","Streptococcus parauberis KCTC 11537, complete genome",23,0.000405801192702636,26.2,0.000463028465216424
"398511","Alkalihalophilus pseudofirmus OF4, complete sequence",23,0.000405801192702636,22.6,0.000398034219776646
"446465","Brachybacterium faecium DSM 4810, complete sequence",21,0.000370514132467624,21.4,0.000377838309431192
"1945662","Paracoccus contaminans strain RKI 16-01929T=LMG 29738T=CCM 8701T=CIP 111112T chromosome, complete genome",21,0.000370514132467624,22.7,0.000400456937492763
"1423755","Ligilactobacillus hayakitensis DSM 18933 = JCM 14209, whole genome shotgun sequence",20,0.000352870602350118,19,0.000335007420960322
"649754","Corynebacterium ammoniagenes DSM 20306 strain DSM 20306 = 9.6 chromosome, complete genome",19,0.000335227072232612,16.8,0.000296603398913235
"1400001","Necropsobacter massiliensis strain FF6, whole genome shotgun sequence",18,0.000317583542115106,17.5,0.000308444890313722
"1236970","Alkalihalobacillus wakoensis JCM 9140, whole genome shotgun sequence",16,0.000282296481880095,14.7,0.000259530686238883
"1380365","Dyella japonica UNC79MFTsu3.2 N515DRAFT_scaffold00013.13_C, whole genome shotgun sequence",15,0.000264652951762589,12.4,0.000219622035804935
"748909","Nocardioides alpinus strain CGMCC 1.10697, whole genome shotgun sequence",15,0.000264652951762589,13.9,0.000245683041887795
"1072256","Corynebacterium uterequi strain DSM 45634 chromosome, complete genome",15,0.000264652951762589,11.2,0.000198109312043756
"1855383","Chelativorans sp. A52C2, whole genome shotgun sequence",15,0.000264652951762589,14,0.000246246731096892
"1122245","Moraxella cuniculi DSM 21768, whole genome shotgun sequence",14,0.000247009421645083,12.9,0.000227623082248215
"1120977","Alkanindiges illinoisensis DSM 15370 Q337DRAFT_scaffold00011.11_C, whole genome shotgun sequence",13,0.000229365891527577,11.9,0.000210264069701256
"1348654","Neobacillus niacini NBRC 15566, whole genome shotgun sequence",12,0.000211722361410071,12.2,0.000215990105781393
"79883","Sutcliffiella horikoshii strain 20a chromosome, complete genome",11,0.000194078831292565,11.6,0.000204709831827038
"1122128","Jeotgalicoccus marinus DSM 19772 H624DRAFT_scaffold00026.26_C, whole genome shotgun sequence",11,0.000194078831292565,11.9,0.000209314578570796
"767452","Serinicoccus chungangensis strain CD08_5 CD08_5_contig_15_consensus, whole genome shotgun sequence",11,0.000194078831292565,10.2,0.000180192003418502
"930124","Metabacillus halosaccharovorans strain DSM 25387 Scaffold1, whole genome shotgun sequence",11,0.000194078831292565,12.2,0.000215529062426273
"1458465","Megasphaera elsdenii 14-14 chromosome, complete genome",10,0.000176435301175059,9.9,0.000175471632901815
"224914","Brucella melitensis bv. 1 str. 16M chromosome I, complete sequence",10,0.000176435301175059,13.1,0.000230335187877124
"191610","Corynebacterium atypicum strain R2070 chromosome, complete genome",10,0.000176435301175059,11,0.000194516962526804
"1449353","Phaeacidiphilus oryzae TH49 BS73DRAFT_unitig_14_quiver.5_C, whole genome shotgun sequence",10,0.000176435301175059,8.7,0.000153661184258849
"416872","Halomonas saccharevitans strain CGMCC 1.6493, whole genome shotgun sequence",10,0.000176435301175059,10,0.000175729961046761
"1121015","Arenimonas oryziterrae DSM 21050 = YC6267 strain DSM 21050 G467DRAFT_scaffold00003.3_C, whole genome shotgun sequence",10,0.000176435301175059,10,0.00017673385113524
"399739","Pseudomonas mendocina ymp, complete sequence",9,0.000158791771057553,9.7,0.000170389888941975
"29486","Yersinia ruckeri strain Big Creek 74 chromosome, complete genome",9,0.000158791771057553,8.3,0.000146115366078594
"1449343","Carnobacterium pleistocenium FTR1 BP17DRAFT_scf7180000000008_quiver_dupTrim_9589.2_C, whole genome shotgun sequence",9,0.000158791771057553,8.6,0.00015225660695372
"642780","Marmoricola scoriae strain DSM 22127 chromosome I",9,0.000158791771057553,9.1,0.000160026202279627
"382245","Aeromonas salmonicida subsp. salmonicida A449, complete sequence",8,0.000141148240940047,8.1,0.000142484861347638
"266265","Paraburkholderia xenovorans LB400 chromosome 1, complete sequence",8,0.000141148240940047,7.1,0.000125915842313235
"38815","Desulfuromonas acetexigens isolate DSM 1397, whole genome shotgun sequence",8,0.000141148240940047,7.2,0.000127200675718901
"450851","Phenylobacterium zucineum HLK1, complete sequence",8,0.000141148240940047,7.6,0.000134439753251767
"1349773","Micrococcus lylae NBRC 15355, whole genome shotgun sequence",7,0.000123504710822541,8.9,0.000156325877442883
"99287","Salmonella enterica subsp. enterica serovar Typhimurium str. LT2, complete genome",7,0.000123504710822541,6.8,0.000120217771346239
"53374","Corynebacterium coyleae strain DSM 44184, whole genome shotgun sequence",7,0.000123504710822541,8.9,0.000157719448205325
"1304275","Salinisphaera hydrothermalis C41B8 contig77, whole genome shotgun sequence",7,0.000123504710822541,7,0.000123608896617608
"1630135","Dermabacter vaginalis strain AD1-86 chromosome, complete genome",7,0.000123504710822541,7,0.000123234842817278
"1377","Aerococcus viridans strain CCUG4311 chromosome, complete genome",6,0.000105861180705035,5.2,9.19760035679948e-05
"85968","Mycolicibacterium brumae isolate MBR1, whole genome shotgun sequence",6,0.000105861180705035,6.4,0.000113409308529014
"203122","Saccharophagus degradans 2-40, complete sequence",6,0.000105861180705035,5.1,9.05242178136509e-05
"1122244","Moraxella caprae DSM 19149 K941DRAFT_scaffold00001.1_C, whole genome shotgun sequence",6,0.000105861180705035,6.4,0.000113578194191221
"864069","Microvirga lotononidis strain WSM3557 Micloscaffold_10, whole genome shotgun sequence",6,0.000105861180705035,6,0.000105852782805604
"1385518","Knoellia flava TL1 contig88, whole genome shotgun sequence",6,0.000105861180705035,6,0.000106295968467785
"1114924","Albimonas pacifica strain CGMCC 1.11030, whole genome shotgun sequence",6,0.000105861180705035,6.1,0.000108427201589756
"1434701","Chishuiella changwenlii strain DSM 27989, whole genome shotgun sequence",6,0.000105861180705035,6,0.000105861180705036
"469616","Fusobacterium mortiferum ATCC 9817 supercont2.7, whole genome shotgun sequence",5,8.82176505875296e-05,5,8.82176250388212e-05
"981334","Acinetobacter radioresistens DSM 6976 = NBRC 102413 = CIP 103788 acLrZ-supercont1.12, whole genome shotgun sequence",5,8.82176505875296e-05,5,8.8858616904749e-05
"92947","Ketogulonicigenium robustum strain SPU_B003 chromosome, complete genome",5,8.82176505875296e-05,5.5,9.69046568410543e-05
"115433","Amycolatopsis sacchari strain DSM 44468, whole genome shotgun sequence",5,8.82176505875296e-05,4.7,8.29164919459776e-05
"548476","Corynebacterium aurimucosum ATCC 700975, complete sequence",5,8.82176505875296e-05,4.6,8.09885106703481e-05
"192812","Qipengyuania flava strain VG1 chromosome, complete genome",5,8.82176505875296e-05,5.2,9.10873752759859e-05
"291169","Methylophaga muralis strain Bur 1 A9E74_contig000087, whole genome shotgun sequence",5,8.82176505875296e-05,6.1,0.000107811337888044
"1123233","Salinicoccus luteus DSM 17002 BO53DRAFT_scaffold00012.12_C, whole genome shotgun sequence",5,8.82176505875296e-05,5,8.85956292978638e-05
"981222","Chloracidobacterium thermophilum B chromosome 1, complete sequence",5,8.82176505875296e-05,5,8.80935777263726e-05
"1117702","Novosphingobium fuchskuhlense strain FNE08-7 PRJNA299317_s001, whole genome shotgun sequence",5,8.82176505875296e-05,4.3,7.65836798248937e-05
"1888195","Streptococcus himalayensis strain HTS2 chromosome, complete genome",5,8.82176505875296e-05,5.1,8.91305832868269e-05
"300267","Shigella dysenteriae Sd197, complete sequence",4,7.05741204700236e-05,5,8.74015258244409e-05
"71421","Haemophilus influenzae Rd KW20, complete sequence",4,7.05741204700236e-05,3.2,5.67901908981543e-05
"1661","Trueperella pyogenes strain TP6375 chromosome, complete genome",4,7.05741204700236e-05,4.2,7.46758454810319e-05
"29571","Halomonas subglaciescola strain ACAM 12 chromosome I",4,7.05741204700236e-05,4.5,7.95269439230276e-05
"34062","Moraxella osloensis strain CCUG 350 chromosome, complete genome",4,7.05741204700236e-05,3.4,6.07834569916781e-05
"1123016","Stutzerimonas balearica DSM 6083 strain DSM6083 (=SP1402) chromosome, complete genome",4,7.05741204700236e-05,3.8,6.79208712118223e-05
"1120961","Ahrensia kielensis DSM 5890 C504DRAFT_scaffold00003.3, whole genome shotgun sequence",4,7.05741204700236e-05,4,7.07616999978463e-05
"84521","Dolosicoccus paucivorans strain DSM 15742, whole genome shotgun sequence",4,7.05741204700236e-05,4.8,8.44694460492017e-05
"90241","Moraxella lincolnii strain CCUG 9405 CCUG9405T_R1__paired__trimmed__paired__contig_21, whole genome shotgun sequence",4,7.05741204700236e-05,4.8,8.48827743836577e-05
"96773","Thauera chlorobenzoica strain 3CB1 chromosome, complete genome",4,7.05741204700236e-05,3.9,6.82716717430661e-05
"120956","Facklamia miroungae strain ATCC BAA-466, whole genome shotgun sequence",4,7.05741204700236e-05,3.8,6.63098095174684e-05
"1122142","Lachnobacterium bovis DSM 14045, whole genome shotgun sequence",4,7.05741204700236e-05,4.3,7.53402700760367e-05
"146827","Corynebacterium simulans strain PES1 chromosome, complete genome",4,7.05741204700236e-05,3.9,6.83192991595651e-05
"765914","Thiorhodospira sibirica ATCC 700588 ctg271, whole genome shotgun sequence",4,7.05741204700236e-05,3.7,6.51980699647541e-05
"169292","Corynebacterium aurimucosum strain 1237_CAUR 173_5055_550973_73_,90+,99+, whole genome shotgun sequence",4,7.05741204700236e-05,5.1,8.99671272285501e-05
"1064537","Brachybacterium paraconglomeratum LC44 LC44_rep_c82, whole genome shotgun sequence",4,7.05741204700236e-05,4.4,7.74531597256349e-05
"1298593","Thalassolituus oleivorans MIL-1, complete sequence",4,7.05741204700236e-05,4.1,7.2288423932004e-05
"1120926","Acinetobacter gerneri DSM 14967 = CIP 107464 = MTCC 9824 strain CIP 107464 acLZs-supercont1.27, whole genome shotgun sequence",4,7.05741204700236e-05,4.6,8.05140135514575e-05
"261164","Psychrobacter alimentarius strain PAMC 27889 chromosome, complete genome",4,7.05741204700236e-05,4.3,7.52687426104341e-05
"304268","Litchfieldia alkalitelluris strain DSM 16976 Scaffold1, whole genome shotgun sequence",4,7.05741204700236e-05,4.1,7.2234039113874e-05
"1122967","Pontibacter roseus DSM 17521 B051DRAFT_scaffold_10.11, whole genome shotgun sequence",4,7.05741204700236e-05,4.2,7.43192420686247e-05
"1122622","Ornithinimicrobium pekingense DSM 21552 K330DRAFT_scaffold00001.1_C, whole genome shotgun sequence",4,7.05741204700236e-05,3.8,6.69900787415892e-05
"529884","Rhodoluna lacicola strain MWH-Ta8 chromosome, complete genome",4,7.05741204700236e-05,3.6,6.30102182321702e-05
"1323663","Halopseudomonas pelagia CL-AP6 111.KCCM90073.1_43, whole genome shotgun sequence",4,7.05741204700236e-05,5,8.83211684718027e-05
"1238182","Caenispirillum salinarum AK4 contig23, whole genome shotgun sequence",4,7.05741204700236e-05,6.5,0.000115034078868416
"1221500","Fictibacillus phosphorivorans strain G25-29 chromosome, complete genome",4,7.05741204700236e-05,4.5,7.9709176154073e-05
"1408189","Corynebacterium lactis RW2-5 chromosome, complete genome",4,7.05741204700236e-05,3.7,6.4786300897536e-05
"1347368","Bacillus ndiopicus isolate FF3, whole genome shotgun sequence",4,7.05741204700236e-05,4.2,7.34959244189016e-05
"1933880","Glutamicibacter halophytocola strain KLBMP 5180 chromosome, complete genome",4,7.05741204700236e-05,3.6,6.30569457720646e-05
"28091","Neisseria weaveri strain NCTC13585 chromosome 1, complete sequence",3,5.29305903525177e-05,3,5.31502736839527e-05
"72758","Staphylococcus capitis subsp. capitis strain AYP1020 chromosome, complete genome",3,5.29305903525177e-05,3.1,5.53824040556113e-05
"1170318","Cutibacterium avidum 44067, complete sequence",3,5.29305903525177e-05,2.4,4.25649482514819e-05
"998674","Leucothrix mucor DSM 2157 LeumuDRAFT_contig1.1_C, whole genome shotgun sequence",3,5.29305903525177e-05,4.5,7.96768280384846e-05
"1191209","Halomonas desiderata SP1 contig_132, whole genome shotgun sequence",3,5.29305903525177e-05,2.9,5.1169399530813e-05
"71999","Kocuria palustris strain MU14/1 chromosome, complete genome",3,5.29305903525177e-05,3.2,5.58349061873927e-05
"525328","Lactobacillus iners DSM 13335 SCAFFOLD3, whole genome shotgun sequence",3,5.29305903525177e-05,2.6,4.62492681334239e-05
"1121355","Corynebacterium caspium DSM 44850 A3E5DRAFT_scaffold_5.6, whole genome shotgun sequence",3,5.29305903525177e-05,3.4,6.0599305903973e-05
"243924","Pseudomonas lutea strain DSM 17257 Contig001, whole genome shotgun sequence",3,5.29305903525177e-05,3,5.23939707289016e-05
"999386","Acidovorax radicis N35 contig00030, whole genome shotgun sequence",3,5.29305903525177e-05,2.7,4.68739924665837e-05
"1230338","Moraxella macacae 0408225 strain 408225 chrom_contig1, whole genome shotgun sequence",3,5.29305903525177e-05,3.1,5.55205910118549e-05
"863239","Corynebacterium nuruki S6-4 contig00061, whole genome shotgun sequence",3,5.29305903525177e-05,3.1,5.38688050412222e-05
"1033739","Kurthia massiliensis strain JC30, whole genome shotgun sequence",3,5.29305903525177e-05,3,5.28647380545335e-05
"1045774","Nocardioides lianchengensis strain CGMCC 4.6858, whole genome shotgun sequence",3,5.29305903525177e-05,4.1,7.20523381252871e-05
"1513271","Catenovulum maritimum strain Q1 scaffold41, whole genome shotgun sequence",3,5.29305903525177e-05,3.3,5.75854164577154e-05
"1610492","Pontibacter ummariensis strain NKM1, whole genome shotgun sequence",3,5.29305903525177e-05,2.7,4.82088833712823e-05
"1612308","Methylocapsa palsarum strain NE2, whole genome shotgun sequence",3,5.29305903525177e-05,2.4,4.2288759780032e-05
"1852390","Corynebacterium fournieri strain Marseille-P2948, whole genome shotgun sequence",3,5.29305903525177e-05,3.5,6.15211366608919e-05
"983594","Burkholderia cepacia ATCC 25416 strain UCB 717 chromosome 1",2,3.52870602350118e-05,2.4,4.2514777886544e-05
"467705","Streptococcus gordonii str. Challis substr. CH1, complete sequence",2,3.52870602350118e-05,2.1,3.67161515039632e-05
"226185","Enterococcus faecalis V583, complete sequence",2,3.52870602350118e-05,2.2,3.85448991734991e-05
"573061","Clostridium cellulovorans 743B, complete sequence",2,3.52870602350118e-05,2,3.55580949497269e-05
"1571","Sporosarcina ureae strain P17a chromosome, complete genome",2,3.52870602350118e-05,2.1,3.64012008786701e-05
"1354275","Mycolicibacterium vaccae 95051 chromosome, complete genome",2,3.52870602350118e-05,2.3,4.08691593024986e-05
"2074","Pseudonocardia autotrophica strain NRRL B-16064 contig75.1, whole genome shotgun sequence",2,3.52870602350118e-05,2.2,3.80627651053674e-05
"553190","Gardnerella vaginalis 409-05, complete sequence",2,3.52870602350118e-05,1.9,3.31120118989659e-05
"525284","Gardnerella vaginalis ATCC 14019, complete sequence",2,3.52870602350118e-05,2.1,3.75032316812423e-05
"1206725","Nocardia brevicatena NBRC 12119, whole genome shotgun sequence",2,3.52870602350118e-05,1.9,3.42055221336022e-05
"765910","Marichromatium purpuratum 984 chromosome, complete genome",2,3.52870602350118e-05,2.5,4.42151974482782e-05
"1349768","Rothia kristinae NBRC 15354, whole genome shotgun sequence",2,3.52870602350118e-05,3.3,5.77302113827728e-05
"1122219","Megasphaera cerevisiae DSM 20462 scaffold_109, whole genome shotgun sequence",2,3.52870602350118e-05,2.1,3.62955230659112e-05
"515619","[Eubacterium] rectale ATCC 33656, complete sequence",2,3.52870602350118e-05,2.1,3.70103855020815e-05
"47229","Massilia timonae strain NEU LO55.unitig, whole genome shotgun sequence",2,3.52870602350118e-05,2.3,4.09165875003953e-05
"393595","Alcanivorax borkumensis SK2, complete sequence",2,3.52870602350118e-05,2.1,3.77226432989704e-05
"134849","Cryptosporangium aurantiacum strain DSM 46144, whole genome shotgun sequence",2,3.52870602350118e-05,2.2,3.88047576981176e-05
"137838","Clostridium neonatale strain LCDC no.99-A-005, whole genome shotgun sequence",2,3.52870602350118e-05,2.1,3.68640295465446e-05
"1185653","Planococcus antarcticus DSM 14505 chromosome, complete genome",2,3.52870602350118e-05,1.9,3.34160627672139e-05
"1234381","Thauera aminoaromatica S2 Cont193, whole genome shotgun sequence",2,3.52870602350118e-05,2.2,3.92837132058178e-05
"1123251","Serinicoccus marinus DSM 15273 K342DRAFT_scaffold00024.24_C, whole genome shotgun sequence",2,3.52870602350118e-05,2.2,3.95159758603517e-05
"523791","Kangiella koreensis DSM 16069, complete sequence",2,3.52870602350118e-05,2.5,4.42413437888414e-05
"1124983","Pseudomonas protegens CHA0, complete sequence",2,3.52870602350118e-05,1.7,3.02681073816864e-05
"454194","Pyrinomonas methylaliphatogenes strain K22, whole genome shotgun sequence",2,3.52870602350118e-05,2,3.54111330957482e-05
"915437","Saccharibacillus sacchari DSM 19268 SacsacDRAFT_Scaffold1.1, whole genome shotgun sequence",2,3.52870602350118e-05,2.1,3.67022394986302e-05
"507626","Halomonas chromatireducens strain AGD 8-3 chromosome, complete genome",2,3.52870602350118e-05,2.1,3.68417344774729e-05
"571913","Luteipulveratus mongoliensis strain MN07-A0370 chromosome",2,3.52870602350118e-05,2,3.46103684721023e-05
"574651","Nocardioides terrae strain CGMCC 1.7056, whole genome shotgun sequence",2,3.52870602350118e-05,2,3.59897770041022e-05
"763034","Bacteroides fluxus YIT 12057 Scfld34, whole genome shotgun sequence",2,3.52870602350118e-05,2,3.52870602350119e-05
"857252","Halopseudomonas aestusnigri strain VGXO14 scaffold00028, whole genome shotgun sequence",2,3.52870602350118e-05,2.1,3.71571544676001e-05
"938293","Anaerococcus provencensis strain 9402080, whole genome shotgun sequence",2,3.52870602350118e-05,2,3.52870602349795e-05
"995034","Mycetocola miduiensis strain CGMCC 1.11101, whole genome shotgun sequence",2,3.52870602350118e-05,1.7,3.00118207677915e-05
"1076620","Pseudomonas zeshuii strain KACC 15471, whole genome shotgun sequence",2,3.52870602350118e-05,1.7,2.94292774967306e-05
"1631356","Luteipulveratus halotolerans strain C296001 unitig_0_quiver_44, whole genome shotgun sequence",2,3.52870602350118e-05,2.2,3.80456850748293e-05
"1638984","Demequina pelophila strain NBRC 109393, whole genome shotgun sequence",2,3.52870602350118e-05,2.1,3.64285747836899e-05
"1720192","Corynebacterium bouchesdurhonense strain SN14, whole genome shotgun sequence",2,3.52870602350118e-05,2.3,4.07495497431351e-05
"1852776","Perlucidibaca aquatica strain BK296 contig_2, whole genome shotgun sequence",2,3.52870602350118e-05,2.1,3.76673715685165e-05
"98804","Buchnera aphidicola (Tuberolachnus salignus) strain BTs isolate Pazieg chromosome 1, complete sequence",1,1.76435301175059e-05,1.4,2.54147621864243e-05
"1114970","Pseudomonas ogarae, complete sequence",1,1.76435301175059e-05,1.1,1.88042948510095e-05
"595536","Methylosinus trichosporium OB3b MettrDRAFT_Contig106_C, whole genome shotgun sequence",1,1.76435301175059e-05,1.1,1.86452932302892e-05
"227377","Coxiella burnetii RSA 493, complete genome",1,1.76435301175059e-05,1,1.80484119384827e-05
"1112","Erythrobacter neustonensis strain DSM 9434 chromosome, complete genome",1,1.76435301175059e-05,1,1.73913023200227e-05
"317619","Prochlorothrix hollandica PCC 9006 = CALU 1027 strain PCC 9006 Pro9006DRAFT_Contig3.7, whole genome shotgun sequence",1,1.76435301175059e-05,1,1.76435301175059e-05
"1293","Staphylococcus gallinarum strain DSM 20610 contig_182, whole genome shotgun sequence",1,1.76435301175059e-05,1.1,1.96521776193587e-05
"759913","Streptococcus dysgalactiae subsp. equisimilis AC-2713, complete sequence",1,1.76435301175059e-05,1.1,2.0284495961629e-05
"1575","Leifsonia xyli strain 356_LXYL 135_135677_3808226_13+,132_, whole genome shotgun sequence",1,1.76435301175059e-05,1,1.82584007262551e-05
"169963","Listeria monocytogenes EGD-e chromosome, complete genome",1,1.76435301175059e-05,0.8,1.43573122749721e-05
"1147128","Bifidobacterium asteroides PRL2011, complete sequence",1,1.76435301175059e-05,1.1,1.95103781277225e-05
"1710","Cellulosimicrobium cellulans strain JZ5 J5_S3.NODE_205, whole genome shotgun sequence",1,1.76435301175059e-05,1.7,3.06696706327193e-05
"700508","Mycolicibacterium neoaurum VKM Ac-1815D, complete sequence",1,1.76435301175059e-05,1,1.79293409147817e-05
"1265861","Brochothrix campestris FSL F6-1037 rep_c86, whole genome shotgun sequence",1,1.76435301175059e-05,1,1.76552104823594e-05
"698737","Staphylococcus lugdunensis HKU09-01, complete sequence",1,1.76435301175059e-05,0.9,1.5151325736854e-05
"28066","Rhodoferax fermentans strain JCM 7819 contig02, whole genome shotgun sequence",1,1.76435301175059e-05,1.7,3.06283347538897e-05
"550540","Ferrimonas balearica DSM 9799, complete sequence",1,1.76435301175059e-05,1,1.76435322168207e-05
"48936","Novosphingobium subterraneum strain DSM 12447 NJ75_contig000007, whole genome shotgun sequence",1,1.76435301175059e-05,1.8,3.18258687980674e-05
"50340","Pseudomonas fuscovaginae strain LMG 2158 chromosome I",1,1.76435301175059e-05,1.2,2.13951046063752e-05
"1300150","Enterococcus mundtii QU 25, complete sequence",1,1.76435301175059e-05,1.4,2.52540848258225e-05
"53408","Pseudomonas citronellolis strain SJTE-3 chromosome, complete genome",1,1.76435301175059e-05,1,1.84731703051185e-05
"1358411","Pantoea dispersa EGD-AAK13 contig38, whole genome shotgun sequence",1,1.76435301175059e-05,1,1.75807224330417e-05
"1123053","Rheinheimera baltica DSM 14885 H595DRAFT_scaffold00120.120_C, whole genome shotgun sequence",1,1.76435301175059e-05,1,1.78612740654111e-05
"67855","Muribacter muris strain Ackerman80-443D cont64, whole genome shotgun sequence",1,1.76435301175059e-05,1.1,1.95054287145646e-05
"76853","Solibacillus silvestris strain DSM 12223 chromosome, complete genome",1,1.76435301175059e-05,0.6,1.04685351983792e-05
"1354252","Buttiauxella ferragutiae ATCC 51602 Sequence00068, whole genome shotgun sequence",1,1.76435301175059e-05,1,1.76640681900545e-05
"92835","Microbacterium ketosireducens strain DSM 12510 RS81_contig000009, whole genome shotgun sequence",1,1.76435301175059e-05,1,1.72200154477028e-05
"1193119","Alkalibacillus haloalkaliphilus C5 contig254, whole genome shotgun sequence",1,1.76435301175059e-05,1,1.76507238230287e-05
"471854","Dyadobacter fermentans DSM 18053, complete sequence",1,1.76435301175059e-05,1,1.7642495793982e-05
