"TaxonomyID","Genome","read_count","Proportion","readsEM","EMProportion"
"569857","Staphylococcus microti strain DSM 22147 contig_104, whole genome shotgun sequence",1,1.60639989719041e-05,1,1.63401964228376e-05
"571915","Corynebacterium mustelae strain DSM 45274 chromosome, complete genome",1,1.60639989719041e-05,1.1,1.71802729713338e-05
"588932","Brevundimonas naejangsanensis strain B1 chromosome, complete genome",1,1.60639989719041e-05,1.4,2.2187197674967e-05
"762211","Bifidobacterium stellenboschense strain DSM 23968 Contig01, whole genome shotgun sequence",1,1.60639989719041e-05,2.1,3.3048519708181e-05
"766136","Desulfuribacillus alkaliarsenatis strain AHT28 DSM-24608_Contig_27_85X, whole genome shotgun sequence",1,1.60639989719041e-05,1.6,2.5368348645434e-05
"930124","Metabacillus halosaccharovorans strain DSM 25387 Scaffold1, whole genome shotgun sequence",1,1.60639989719041e-05,1.1,1.79853638796538e-05
"1225786","Dickeya solani IPO 2222 chromosome, complete genome",1,1.60639989719041e-05,1.2,1.95999334408623e-05
"1118379","Mycolicibacter minnesotensis strain DSM 45633 NODE_22_length_69511_cov_78.0268, whole genome shotgun sequence",1,1.60639989719041e-05,1.3,2.11462065894683e-05
"1231336","Schleiferilactobacillus shenzhenensis LY-73 LY73.Scaffold52, whole genome shotgun sequence",1,1.60639989719041e-05,1,1.66254032533385e-05
"1236220","Melghirimyces thermohalophilus strain DSM 45514, whole genome shotgun sequence",1,1.60639989719041e-05,1.2,1.88323575383832e-05
"1247024","Arsenophonus endosymbiont str. Hangzhou of Nilaparvata lugens strain Hangzhou contig6, whole genome shotgun sequence",1,1.60639989719041e-05,1,1.60727674235031e-05
"521393","Actinomyces timonensis DSM 23838 strain 7400942 scaffold00004, whole genome shotgun sequence",1,1.60639989719041e-05,1,1.6290615188151e-05
"1567108","Rufibacter roseus strain CCM 8621 contig_33, whole genome shotgun sequence",1,1.60639989719041e-05,1,1.60639989978479e-05
"1619308","Cnuibacter physcomitrellae strain XA(T) chromosome, complete genome",1,1.60639989719041e-05,1.1,1.74039347042344e-05
"1816695","Bacillus tuaregi strain Marseille-P2489T, whole genome shotgun sequence",1,1.60639989719041e-05,1.2,1.86106485842332e-05
"1855823","Macrococcus canis strain KM 45013 chromosome, complete genome",1,1.60639989719041e-05,1.2,1.98100605253598e-05
