"TaxonomyID","Genome","read_count","Proportion","readsEM","EMProportion"
"1122128","Jeotgalicoccus marinus DSM 19772 H624DRAFT_scaffold00026.26_C, whole genome shotgun sequence",1,5.36918517245823e-06,0.9,4.74340033409392e-06
"518642","Streptomyces nanshensis strain SCSIO 10429 scaffold117, whole genome shotgun sequence",1,5.36918517245823e-06,1.2,6.17709423144455e-06
"522492","Pseudomonas massiliensis strain CB1, whole genome shotgun sequence",1,5.36918517245823e-06,1.1,5.80208336091233e-06
"536018","Mesorhizobium australicum strain B5P, whole genome shotgun sequence",1,5.36918517245823e-06,1.1,5.86265519002068e-06
"544580","Actinomyces oris strain T14V chromosome, complete genome",1,5.36918517245823e-06,1,5.62587672733503e-06
"1255705","Bavariicoccus seileri WCC 4188 strain DSM 19936 H541DRAFT_scaffold00106.106_C, whole genome shotgun sequence",1,5.36918517245823e-06,1.1,5.97131649816243e-06
"1238190","Halomonas jeotgali Hwa 50.KUC.1_15, whole genome shotgun sequence",1,5.36918517245823e-06,1,5.3717490417129e-06
"1917864","Indiicoccus explosivorum isolate S5-TSA-19 S5TSA19.ioncontig_57, whole genome shotgun sequence",1,5.36918517245823e-06,1.1,5.65440088673069e-06
"582672","Methylobacterium phyllostachyos strain BL47, whole genome shotgun sequence",1,5.36918517245823e-06,1.1,6.12525724503311e-06
"763034","Bacteroides fluxus YIT 12057 Scfld34, whole genome shotgun sequence",1,5.36918517245823e-06,1,5.4093964602753e-06
"1196031","Cytobacillus oceanisediminis 2691 chromosome, complete genome",1,5.36918517245823e-06,1,5.63284259626632e-06
"754476","Methylophaga nitratireducenticrescens, complete sequence",1,5.36918517245823e-06,1.1,6.11583603926113e-06
"859144","Cytobacillus gottheilii strain FJAT-2394 Scaffold1, whole genome shotgun sequence",1,5.36918517245823e-06,1.2,6.56709751645963e-06
"876269","Methyloferula stellata AR4 strain AR4T A3OQDRAFT_chromosome1.1_C, whole genome shotgun sequence",1,5.36918517245823e-06,1.5,8.17089521818183e-06
"927083","Sandaracinus amylolyticus strain DSM 53668 chromosome, complete genome",1,5.36918517245823e-06,1,5.38569990965977e-06
"1033734","Bacillus timonensis strain MM10403188, whole genome shotgun sequence",1,5.36918517245823e-06,1.1,5.95463159419751e-06
"1033739","Kurthia massiliensis strain JC30, whole genome shotgun sequence",1,5.36918517245823e-06,1,5.4048361049176e-06
"1070870","Geodermatophilus nigrescens strain DSM 45408, whole genome shotgun sequence",1,5.36918517245823e-06,0.9,4.6339402349964e-06
"1071918","Riemerella columbipharyngis strain DSM 24015, whole genome shotgun sequence",1,5.36918517245823e-06,1,5.36969598330453e-06
"1225786","Dickeya solani IPO 2222 chromosome, complete genome",1,5.36918517245823e-06,0.8,4.29743096951658e-06
"1096243","Idiomarina piscisalsi strain 10PY1A chromosome, complete genome",1,5.36918517245823e-06,1,5.45393298427706e-06
"1101373","Tepidimonas fonticaldi strain PL17 contig_1, whole genome shotgun sequence",1,5.36918517245823e-06,1.1,6.12006385336151e-06
"1121001","Andreprevotia lacus DSM 23236, whole genome shotgun sequence",1,5.36918517245823e-06,1,5.37027436063905e-06
"1134413","Halalkalibacterium ligniniphilum strain L1 contig139, whole genome shotgun sequence",1,5.36918517245823e-06,0.6,3.35680684759168e-06
"1155689","Psychroflexus salarius strain DSM 25661, whole genome shotgun sequence",1,5.36918517245823e-06,0.5,2.61781336134536e-06
"1208321","Marinomonas profundimaris strain D104 contig48, whole genome shotgun sequence",1,5.36918517245823e-06,1.1,5.86346890935994e-06
"562743","Amphibacillus jilinensis Y1 Scaffold10, whole genome shotgun sequence",1,5.36918517245823e-06,1,5.47709941399215e-06
"1218508","Bombilactobacillus mellis strain Hon2 Hon2_scaffold4, whole genome shotgun sequence",1,5.36918517245823e-06,1.7,8.89726536479308e-06
"1221500","Fictibacillus phosphorivorans strain G25-29 chromosome, complete genome",1,5.36918517245823e-06,1.6,8.34419031684788e-06
"1239307","Sodalis praecaptivus strain HS1 chromosome, complete genome",1,5.36918517245823e-06,1,5.62256144933613e-06
"1247963","Parvularcula oceani strain JLT2013 contig00026, whole genome shotgun sequence",1,5.36918517245823e-06,1.4,7.47502252938644e-06
"493385","Methylogaea oryzae JCM 16910, whole genome shotgun sequence",1,5.36918517245823e-06,1.1,5.88162225684933e-06
"1437453","Streptomyces leeuwenhoekii strain type strain (C34 = DSM 42122 = NRRL B-24963) chromosome 1",1,5.36918517245823e-06,3,1.62409462683762e-05
"1449080","Thermus amyloliquefaciens strain YIM 77409 BS74DRAFT_scf7180000000012_quiver_dupTrim_10634.3_C, whole genome shotgun sequence",1,5.36918517245823e-06,1,5.37037040218366e-06
"1072685","Basilea psittacipulmonis DSM 24701 chromosome, complete genome",1,5.36918517245823e-06,1,5.39235651906976e-06
"1547597","Sanguibacteroides justesenii strain OUH 308042 contig12, whole genome shotgun sequence",1,5.36918517245823e-06,1,5.57249217882748e-06
"1560201","Erwinia iniecta strain B120 contig000058, whole genome shotgun sequence",1,5.36918517245823e-06,1.2,6.51851634366205e-06
"1562701","Bacterium endosymbiont of Mortierella elongata FMR23-6, whole genome shotgun sequence",1,5.36918517245823e-06,1,5.43105306145043e-06
"1567108","Rufibacter roseus strain CCM 8621 contig_33, whole genome shotgun sequence",1,5.36918517245823e-06,1.1,6.04606130200011e-06
"1608583","Streptococcus varani strain FF10, whole genome shotgun sequence",1,5.36918517245823e-06,0.7,3.95912751902428e-06
"1650663","Fournierella massiliensis strain AM2, whole genome shotgun sequence",1,5.36918517245823e-06,1.1,5.81960255420816e-06
"1720192","Corynebacterium bouchesdurhonense strain SN14, whole genome shotgun sequence",1,5.36918517245823e-06,1,5.58656997302133e-06
"1750561","Legionella saoudiensis strain LS-1, whole genome shotgun sequence",1,5.36918517245823e-06,1,5.57183532467962e-06
"1774971","Methyloceanibacter marginalis strain R-67177 contig_163, whole genome shotgun sequence",1,5.36918517245823e-06,1.5,8.17811978789548e-06
"1838280","Desulfotomaculum copahuensis strain LMa1 LMA27_trimmed_contig_224, whole genome shotgun sequence",1,5.36918517245823e-06,1,5.37172363811359e-06
"1841868","Provencibacterium massiliense strain Marseille-P2780, whole genome shotgun sequence",1,5.36918517245823e-06,1,5.46064432429278e-06
"1852776","Perlucidibaca aquatica strain BK296 contig_2, whole genome shotgun sequence",1,5.36918517245823e-06,0.6,3.44323888351301e-06
