"TaxonomyID","Genome","read_count","Proportion","readsEM","EMProportion"
"883103","Dolosigranulum pigrum ATCC 51524 supercont1.1, whole genome shotgun sequence",159794,0.592446212539717,159770.3,0.592360394832353
"1121368","Corynebacterium pseudodiphtheriticum DSM 44287 O146DRAFT_scaffold00011.11_C, whole genome shotgun sequence",46525,0.172494336698564,46628.8,0.172879760676951
"525260","Corynebacterium accolens ATCC 49725 SCAFFOLD6, whole genome shotgun sequence",25662,0.0951434641237733,24657.9,0.0914209711646123
"753702","Alkalibacterium subtropicum strain DSM 23664, whole genome shotgun sequence",14820,0.0549460735061305,14809.6,0.0549078383753942
"169292","Corynebacterium aurimucosum strain 1237_CAUR 119_59260_1282770, whole genome shotgun sequence",14534,0.0538857106840823,15430.5,0.0572098119310178
"883081","Alloiococcus otitis ATCC 51267 supercont1.2, whole genome shotgun sequence",1173,0.00434897059532328,1190.9,0.00441536510877353
"1121354","Corynebacterium capitovis DSM 44611 A3E3DRAFT_scaffold00005.5_C, whole genome shotgun sequence",1037,0.00384474212050319,1041.8,0.00386249190241456
"936154","Streptococcus parauberis KCTC 11537, complete genome",687,0.00254709531030443,662.1,0.00245489527665106
"1007099","Pseudomonas kuykendallii strain NRRL B-59562, whole genome shotgun sequence",618,0.00229127351057953,618.1,0.00229159507340585
"161895","Corynebacterium phocae strain M408/89/1 chromosome, complete genome",277,0.00102699476121445,223.4,0.000828233957929643
"120956","Facklamia miroungae strain ATCC BAA-466, whole genome shotgun sequence",262,0.000971381326491645,251.4,0.000932095658836549
"191610","Corynebacterium atypicum strain R2070 chromosome, complete genome",215,0.000797125897693526,211.2,0.000782893052029427
"1423755","Ligilactobacillus hayakitensis DSM 18933 = JCM 14209, whole genome shotgun sequence",162,0.000600625095006284,150.1,0.000556671650061815
"1304","Streptococcus salivarius strain NCTC 8618 chromosome, complete genome",150,0.000556134347228041,150.4,0.00055755988574585
"883111","Facklamia hominis CCUG 36813 supercont1.1, whole genome shotgun sequence",114,0.000422662103893311,108.7,0.000403190333365994
"53374","Corynebacterium coyleae strain DSM 44184, whole genome shotgun sequence",110,0.000407831854633897,107.5,0.000398714495212053
"1712031","Streptobacillus notomytis strain KWG2 KWG2_S20CLC_contig_21, whole genome shotgun sequence",110,0.000407831854633897,109.9,0.000407480695619872
"928724","Saccharomonospora glauca K62 chromosome, whole genome shotgun sequence",109,0.000404124292319043,104.5,0.000387581437957653
"519472","Vagococcus teuberi strain DSM 21459 chromosome, complete genome",109,0.000404124292319043,114.6,0.000424734776163362
"649754","Corynebacterium ammoniagenes DSM 20306 strain DSM 20306 = 9.6 chromosome, complete genome",103,0.000381878918429922,113.8,0.00042180215613841
"1284","Staphylococcus hyicus strain ATCC 11249 chromosome, complete genome",99,0.000367048669170507,96,0.000355929716863512
"198214","Shigella flexneri 2a str. 301 chromosome, complete genome",97,0.0003596335445408,91.3,0.000338478951591318
"171101","Streptococcus pneumoniae R6, complete sequence",93,0.000344803295281385,99.4,0.000368376343847987
"1266845","Carnobacterium inhibens subsp. gilichinskyi, complete sequence",93,0.000344803295281385,116.7,0.00043271689176744
"1376","Aerococcus urinae strain CCUG36881 chromosome, complete genome",79,0.000292897422873435,73,0.000270529852715329
"1852390","Corynebacterium fournieri strain Marseille-P2948, whole genome shotgun sequence",76,0.000281774735928874,93.9,0.00034807532748846
"33935","Lysinibacillus macroides strain DSM 54 Scaffold4, whole genome shotgun sequence",74,0.000274359611299167,55.5,0.000205742913966183
"398578","Delftia acidovorans SPH-1, complete sequence",74,0.000274359611299167,73.8,0.000273758032143922
"227882","Streptomyces avermitilis MA-4680 = NBRC 14893, complete sequence",72,0.00026694448666946,60.1,0.000222684249858113
"147645","Paracoccus yeei strain FDAARGOS_252 chromosome, complete genome",69,0.000255821799724899,69,0.000255939459516298
"1575","Leifsonia xyli strain 356_LXYL 135_135677_3808226_13+,132_, whole genome shotgun sequence",64,0.000237283988150631,73.2,0.000271332970751087
"279808","Staphylococcus haemolyticus JCSC1435, complete sequence",58,0.000215038614261509,54.3,0.000201228601021089
"857290","Scardovia wiggsiae F0424 cont1.1, whole genome shotgun sequence",53,0.000196500802687241,50.3,0.000186434171368402
"1231623","Tanticharoenia sakaeratensis NBRC 103193, whole genome shotgun sequence",53,0.000196500802687241,51.5,0.000191023646492472
"966","Oceanospirillum linum strain ATCC 11336 NODE_128_length_432_cov_0.662295, whole genome shotgun sequence",50,0.00018537811574268,49.3,0.000182800012704357
"1347368","Bacillus ndiopicus isolate FF3, whole genome shotgun sequence",48,0.000177962991112973,69.2,0.000256490139729629
"709510","Jeotgalicoccus aerolatus strain CGMCC 1.8911, whole genome shotgun sequence",46,0.000170547866483266,46.2,0.000171265774454994
"83683","Lactobacillus amylolyticus strain L6 chromosome, complete genome",45,0.000166840304168412,44.5,0.000164902806692922
"1907","Streptomyces glaucescens strain GLA.O chromosome, complete genome",44,0.000163132741853559,58,0.00021512830137708
"525328","Lactobacillus iners DSM 13335 SCAFFOLD3, whole genome shotgun sequence",43,0.000159425179538705,43.4,0.000160785642638795
"1124983","Pseudomonas protegens CHA0, complete sequence",42,0.000155717617223851,40.2,0.000149052994049991
"592050","Acidovorax soli strain DSM 25157, whole genome shotgun sequence",42,0.000155717617223851,37.8,0.000140225845961132
"886293","Singulisphaera acidiphila DSM 18658, complete sequence",40,0.000148302492594144,40,0.000148301952704628
"1346614","Serratia liquefaciens ATCC 27592, complete sequence",37,0.000137179805649583,39.8,0.000147724508888837
"1121355","Corynebacterium caspium DSM 44850 A3E5DRAFT_scaffold_5.6, whole genome shotgun sequence",34,0.000126057118705023,33.4,0.000123806963498846
"1437875","Corynebacterium frankenforstense DSM 45800 strain ST18 chromosome, complete genome",34,0.000126057118705023,39.4,0.000146183506709369
"887901","Porphyromonas catoniae ATCC 51270 ctg7180000005748, whole genome shotgun sequence",33,0.000122349556390169,33.7,0.00012493883506538
"1434072","Halopseudomonas salegens strain CECT 8338 chromosome I",33,0.000122349556390169,32.8,0.000121576186199166
"243160","Burkholderia mallei ATCC 23344 chromosome 1, complete sequence",31,0.000114934431760462,29.5,0.000109543210442986
"53406","Pseudomonas anguilliseptica strain DSM 12111, whole genome shotgun sequence",28,0.000103811744815901,30.5,0.000113087511745476
"558173","Corynebacterium doosanense CAU 212 = DSM 45436 strain CAU 212(T) chromosome, complete genome",28,0.000103811744815901,29.7,0.00010993982029881
"402596","Nocardioides exalbidus strain DSM 22017, whole genome shotgun sequence",27,0.000100104182501047,26.4,9.79971212388667e-05
"743972","Actinobacillus suis ATCC 33415 chromosome, complete genome",25,9.26890578713402e-05,24.3,9.02493162316811e-05
"1116391","Paenibacillus mucilaginosus 3016, complete sequence",25,9.26890578713402e-05,23.7,8.79898209443285e-05
"1404245","Corynebacterium glyciniphilum AJ 3170 chromosome, complete genome",25,9.26890578713402e-05,27.5,0.000102077001077508
"1354275","Mycolicibacterium vaccae 95051 chromosome, complete genome",23,8.5273933241633e-05,23.4,8.66909481028183e-05
"85968","Mycolicibacterium brumae isolate MBR1, whole genome shotgun sequence",23,8.5273933241633e-05,22,8.1666106290646e-05
"525640","Paracoccus chinensis strain CGMCC 1.7655, whole genome shotgun sequence",23,8.5273933241633e-05,22.9,8.49218834901684e-05
"642780","Marmoricola scoriae strain DSM 22127 chromosome I",23,8.5273933241633e-05,23.1,8.58303732973139e-05
"742766","Dysgonomonas gadei ATCC BAA-286 supercont1.1, whole genome shotgun sequence",22,8.15663709267793e-05,21.9,8.11320284688187e-05
"269796","Rhodospirillum rubrum ATCC 11170, complete sequence",21,7.78588086119257e-05,21.6,7.99607900189218e-05
"465515","Micrococcus luteus NCTC 2665, complete sequence",20,7.41512462970721e-05,23.1,8.56466244521487e-05
"1217656","Acinetobacter guillouiae NIPH 991 acLrU-supercont1.2, whole genome shotgun sequence",20,7.41512462970721e-05,19.8,7.32845134395136e-05
"196627","Corynebacterium glutamicum ATCC 13032, complete sequence",19,7.04436839822185e-05,25.9,9.61074061846101e-05
"1408189","Corynebacterium lactis RW2-5 chromosome, complete genome",19,7.04436839822185e-05,19.2,7.13180047055627e-05
"213810","Ruminococcus champanellensis 18P13 = JCM 17042, complete sequence",18,6.67361216673649e-05,18.1,6.69440500792313e-05
"1226968","Azospirillum humicireducens strain SgZ-5 chromosome, complete genome",18,6.67361216673649e-05,19.9,7.37849225707721e-05
"1917864","Indiicoccus explosivorum isolate S5-TSA-19 S5TSA19.ioncontig_57, whole genome shotgun sequence",17,6.30285593525113e-05,16.3,6.051865928783e-05
"864069","Microvirga lotononidis strain WSM3557 Micloscaffold_10, whole genome shotgun sequence",17,6.30285593525113e-05,15.7,5.80911112408836e-05
"1817405","Abyssicoccus albus strain S31 chromosome, complete genome",17,6.30285593525113e-05,17.9,6.61990648502721e-05
"28066","Rhodoferax fermentans strain JCM 7819 contig02, whole genome shotgun sequence",16,5.93209970376577e-05,16.1,5.95611185081696e-05
"875093","Streptococcus pseudoporcinus LQ 940-04 Contig1216510750, whole genome shotgun sequence",16,5.93209970376577e-05,12.6,4.66504851049058e-05
"915437","Saccharibacillus sacchari DSM 19268 SacsacDRAFT_Scaffold1.1, whole genome shotgun sequence",16,5.93209970376577e-05,15.3,5.67777502238124e-05
"1072256","Corynebacterium uterequi strain DSM 45634 chromosome, complete genome",16,5.93209970376577e-05,17.8,6.60758468948984e-05
"931626","Acetobacterium woodii DSM 1030, complete sequence",15,5.56134347228041e-05,15,5.56820474672261e-05
"1349768","Rothia kristinae NBRC 15354, whole genome shotgun sequence",15,5.56134347228041e-05,18.2,6.75298296528884e-05
"84521","Dolosicoccus paucivorans strain DSM 15742, whole genome shotgun sequence",15,5.56134347228041e-05,17.4,6.45329263197037e-05
"1349787","[Zimmermannella] bifida NBRC 103089, whole genome shotgun sequence",15,5.56134347228041e-05,14.5,5.3823351745146e-05
"37928","Arthrobacter crystallopoietes strain DSM 20117, whole genome shotgun sequence",14,5.19058724079505e-05,14.3,5.29123197533191e-05
"1131442","Mycobacterium marinum E11 chromosome 1, complete sequence",13,4.81983100930969e-05,15.4,5.71480929310419e-05
"185761","Corynebacterium spheniscorum strain J11, PG 39, whole genome shotgun sequence",13,4.81983100930969e-05,11.4,4.22739781333294e-05
"589865","Desulfurivibrio alkaliphilus AHT 2, complete sequence",13,4.81983100930969e-05,14.1,5.22130179438577e-05
"875454","Peptoniphilus rhinitidis 1-13 strain 42017, whole genome shotgun sequence",13,4.81983100930969e-05,13,4.82733113404937e-05
"1325564","Nitrospira japonica isolate Genome sequencing of Nitrospira japonica strain NJ11 chromosome I, complete sequence",13,4.81983100930969e-05,12.2,4.52738427400387e-05
"1236959","Methylobacillus glycogenes JCM 2850, whole genome shotgun sequence",12,4.44907477782433e-05,13,4.80615465284206e-05
"115433","Amycolatopsis sacchari strain DSM 44468, whole genome shotgun sequence",12,4.44907477782433e-05,13.1,4.84857645348879e-05
"1852776","Perlucidibaca aquatica strain BK296 contig_2, whole genome shotgun sequence",12,4.44907477782433e-05,10.5,3.90486497872693e-05
"267747","Cutibacterium acnes KPA171202, complete sequence",11,4.07831854633897e-05,10.7,3.97064115233078e-05
"1283299","Conexibacter woesei Iso977N H030DRAFT_scaffold00002.2_C, whole genome shotgun sequence",11,4.07831854633897e-05,12,4.43685847446146e-05
"1300345","Lysobacter dokdonensis DS-58 contig21, whole genome shotgun sequence",11,4.07831854633897e-05,11.9,4.40841409630604e-05
"518642","Streptomyces nanshensis strain SCSIO 10429 scaffold117, whole genome shotgun sequence",11,4.07831854633897e-05,10.8,4.01387917104317e-05
"1329250","Weissella oryzae SG25, whole genome shotgun sequence",11,4.07831854633897e-05,10.6,3.93713688992643e-05
"1856850","Pararhizobium arenae strain MIM27 scaffold23, whole genome shotgun sequence",11,4.07831854633897e-05,10.7,3.96089637087632e-05
"553184","Lancefieldella rimae ATCC 49626 contig00008, whole genome shotgun sequence",9,3.33680608336825e-05,8.8,3.27177738979861e-05
"1724","Corynebacterium renale strain CIP 52.96 contig_11, whole genome shotgun sequence",9,3.33680608336825e-05,8.9,3.29313631251294e-05
"220341","Salmonella enterica subsp. enterica serovar Typhi str. CT18, complete sequence",9,3.33680608336825e-05,10.1,3.73969495889834e-05
"32040","Acidovorax konjaci strain DSM 7481, whole genome shotgun sequence",9,3.33680608336825e-05,13.6,5.03910617598603e-05
"863239","Corynebacterium nuruki S6-4 contig00061, whole genome shotgun sequence",9,3.33680608336825e-05,9,3.3445959578022e-05
"1079","Blastochloris viridis strain ATCC 19567 chromosome, complete genome",8,2.96604985188289e-05,7.6,2.82419549531323e-05
"1408","Bacillus pumilus strain SH-B9 chromosome, complete genome",8,2.96604985188289e-05,7.8,2.89146130643291e-05
"1661","Trueperella pyogenes strain TP6375 chromosome, complete genome",8,2.96604985188289e-05,11,4.09007385671881e-05
"29539","Thermoleophilum album strain ATCC 35263, whole genome shotgun sequence",8,2.96604985188289e-05,7.2,2.67258556491522e-05
"79883","Sutcliffiella horikoshii strain 20a chromosome, complete genome",8,2.96604985188289e-05,7.3,2.69945773069007e-05
"498211","Cellvibrio japonicus Ueda107, complete sequence",8,2.96604985188289e-05,8.2,3.04612148880751e-05
"1120977","Alkanindiges illinoisensis DSM 15370 Q337DRAFT_scaffold00011.11_C, whole genome shotgun sequence",8,2.96604985188289e-05,8.1,2.9865171383943e-05
"1123233","Salinicoccus luteus DSM 17002 BO53DRAFT_scaffold00012.12_C, whole genome shotgun sequence",8,2.96604985188289e-05,7.8,2.90538817685307e-05
"1428644","Mangrovactinospora gilvigriseus strain MUSC 26 205, whole genome shotgun sequence",8,2.96604985188289e-05,7.7,2.86982348163974e-05
"1736691","Aeromicrobium choanae strain 9H-4 chromosome I",8,2.96604985188289e-05,8,2.98310673549708e-05
"1888195","Streptococcus himalayensis strain HTS2 chromosome, complete genome",8,2.96604985188289e-05,11.3,4.20716291884587e-05
"160488","Pseudomonas putida KT2440, complete sequence",7,2.59529362039752e-05,7.1,2.63233476032256e-05
"169963","Listeria monocytogenes EGD-e chromosome, complete genome",7,2.59529362039752e-05,6.9,2.55711283069044e-05
"29314","Mycolicibacter hiberniae strain ATCC 49874 contig_16, whole genome shotgun sequence",7,2.59529362039752e-05,7.7,2.86227486670919e-05
"72758","Staphylococcus capitis subsp. capitis strain AYP1020 chromosome, complete genome",7,2.59529362039752e-05,9.7,3.59387465753516e-05
"638301","Granulicatella adiacens ATCC 49175 SCAFFOLD6, whole genome shotgun sequence",7,2.59529362039752e-05,7.1,2.61606641393052e-05
"119206","Aerococcus sanguinicola strain CCUG43001 chromosome, complete genome",7,2.59529362039752e-05,7.1,2.63670055970866e-05
"525263","Corynebacterium lipophiloflavum DSM 44291 SCAFFOLD11, whole genome shotgun sequence",7,2.59529362039752e-05,6.8,2.52296094509401e-05
"233100","Ectothiorhodosinus mongolicus strain M9, whole genome shotgun sequence",7,2.59529362039752e-05,6.8,2.50607793481516e-05
"1036780","Bosea robiniae strain DSM 26672, whole genome shotgun sequence",7,2.59529362039752e-05,7.6,2.82969758954525e-05
"1162717","Pseudostreptobacillus hongkongensis strain DSM 26322 DSM26322_S22CLC_contig_52, whole genome shotgun sequence",7,2.59529362039752e-05,7.1,2.63055795885474e-05
"1445510","Gynuella sunshinyii YC6258 chromosome, complete genome",7,2.59529362039752e-05,6.6,2.43488538703348e-05
"1513271","Catenovulum maritimum strain Q1 scaffold41, whole genome shotgun sequence",7,2.59529362039752e-05,7,2.59704197235482e-05
"1703341","Croceicoccus pelagius strain Ery9 Ery9_C33_119550, whole genome shotgun sequence",7,2.59529362039752e-05,6.5,2.39736681316052e-05
"40041","Streptococcus equi subsp. zooepidemicus, complete sequence",6,2.22453738891216e-05,5.7,2.11278548013896e-05
"1571","Sporosarcina ureae strain P17a chromosome, complete genome",6,2.22453738891216e-05,8.2,3.0243118630111e-05
"1122998","Acidipropionibacterium thoenii DSM 20276 G554DRAFT_scaffold00039.39_C, whole genome shotgun sequence",6,2.22453738891216e-05,6.7,2.49093322349782e-05
"1242245","Acinetobacter johnsonii XBB1 chromosome, complete genome",6,2.22453738891216e-05,6.3,2.34049807597736e-05
"585530","Brevibacterium mcbrellneri ATCC 49030 contig00111, whole genome shotgun sequence",6,2.22453738891216e-05,5.9,2.19286797243681e-05
"1219360","Erwinia persicina NBRC 102418, whole genome shotgun sequence",6,2.22453738891216e-05,5.5,2.04371444176697e-05
"137838","Clostridium neonatale strain LCDC no.99-A-005, whole genome shotgun sequence",6,2.22453738891216e-05,5.9,2.18563105389532e-05
"888727","Eubacterium sulci ATCC 35585 chromosome, complete genome",6,2.22453738891216e-05,6.8,2.51797583252843e-05
"1120978","Allofustis seminis DSM 15817 C231DRAFT_scaffold00012.12, whole genome shotgun sequence",6,2.22453738891216e-05,5.8,2.1669882202308e-05
"1341695","Bifidobacterium bombi DSM 19703 DSM19703_C1, whole genome shotgun sequence",6,2.22453738891216e-05,9.5,3.53288744564669e-05
"1223515","Corynebacterium humireducens NBRC 106098 = DSM 45392 chromosome, complete genome",6,2.22453738891216e-05,6.3,2.32732524198631e-05
"1335309","Chitinophaga costaii strain A37T2, whole genome shotgun sequence",6,2.22453738891216e-05,6,2.2245456426261e-05
"971","Selenomonas ruminantium strain WCT3, whole genome shotgun sequence",5,1.8537811574268e-05,5,1.85648204599668e-05
"1771","Mycolicibacterium phlei strain CCUG 21000 chromosome, complete genome",5,1.8537811574268e-05,5.6,2.07292318704824e-05
"1314751","Sutcliffiella cohnii NBRC 15565, whole genome shotgun sequence",5,1.8537811574268e-05,6.4,2.3576370528631e-05
"79882","Sutcliffiella halmapala strain DSM 8723 Scaffold1, whole genome shotgun sequence",5,1.8537811574268e-05,6.1,2.27128671475083e-05
"1130798","Limosilactobacillus mucosae LM1 chromosome, complete genome",5,1.8537811574268e-05,6,2.24185170801141e-05
"135739","Marinobacter lutaoensis strain T5054 DSM17466_contig_18, whole genome shotgun sequence",5,1.8537811574268e-05,4.3,1.5887307692075e-05
"1123488","Varibaculum cambriense DSM 15806 F605DRAFT_scaffold00001.1_C, whole genome shotgun sequence",5,1.8537811574268e-05,5.4,1.98362156561601e-05
"202789","Actinobaculum massiliense strain FC3, whole genome shotgun sequence",5,1.8537811574268e-05,5.6,2.06586852321584e-05
"1121356","Corynebacterium ciconiae DSM 44920 A3E7DRAFT_scaffold_11.12_C, whole genome shotgun sequence",5,1.8537811574268e-05,6.9,2.56432884929911e-05
"262209","Janibacter melonis strain CD11-4 contig_6, whole genome shotgun sequence",5,1.8537811574268e-05,5,1.84890492273602e-05
"1121015","Arenimonas oryziterrae DSM 21050 = YC6267 strain DSM 21050 G467DRAFT_scaffold00003.3_C, whole genome shotgun sequence",5,1.8537811574268e-05,3.6,1.33040080312896e-05
"1349773","Micrococcus lylae NBRC 15355, whole genome shotgun sequence",4,1.48302492594144e-05,3.8,1.39408063992484e-05
"1717","Corynebacterium diphtheriae strain NCTC11397 chromosome 1, complete sequence",4,1.48302492594144e-05,3.5,1.29111682952477e-05
"314608","Shewanella benthica KT99 1099576005676, whole genome shotgun sequence",4,1.48302492594144e-05,3.3,1.2071034506642e-05
"207559","Oleidesulfovibrio alaskensis G20, complete sequence",4,1.48302492594144e-05,4.2,1.56420748209826e-05
"68895","Cupriavidus basilensis strain 4G11 chromosome main, complete sequence",4,1.48302492594144e-05,4.4,1.64499261167801e-05
"882086","Saccharomonospora xinjiangensis XJ-54 Sacxiscaffold_2, whole genome shotgun sequence",4,1.48302492594144e-05,4.5,1.66563463355012e-05
"1120997","Anaerovibrio lipolyticus DSM 3074, whole genome shotgun sequence",4,1.48302492594144e-05,4.2,1.56022505639784e-05
"1111732","Ignatzschineria larvae DSM 13226 YWGDRAFT_scaffold_50.51_C, whole genome shotgun sequence",4,1.48302492594144e-05,4.6,1.69707637514941e-05
"1298593","Thalassolituus oleivorans MIL-1, complete sequence",4,1.48302492594144e-05,3.7,1.37871921190161e-05
"1336243","Microvirga flocculans ATCC BAA-817 L879DRAFT_scaffold00029.29_C, whole genome shotgun sequence",4,1.48302492594144e-05,3.6,1.34618303626387e-05
"937773","Staphylococcus pseudintermedius HKU10-03, complete sequence",4,1.48302492594144e-05,4.5,1.65637447274627e-05
"402385","Kushneria avicenniae strain DSM 23439, whole genome shotgun sequence",4,1.48302492594144e-05,4.4,1.62245166538302e-05
"1121364","Corynebacterium massiliense DSM 45435 G488DRAFT_scaffold00023.23_C, whole genome shotgun sequence",4,1.48302492594144e-05,4,1.48020537559932e-05
"752179","Occidentia massiliensis strain Os18, whole genome shotgun sequence",4,1.48302492594144e-05,4.2,1.54634427245452e-05
"1130080","Alkalibacterium gilvum strain DSM 25751, whole genome shotgun sequence",4,1.48302492594144e-05,3.4,1.27568340821022e-05
"1135990","Pseudomonas sagittaria strain JCM 18195, whole genome shotgun sequence",4,1.48302492594144e-05,5.5,2.05659673597274e-05
"1650663","Fournierella massiliensis strain AM2, whole genome shotgun sequence",4,1.48302492594144e-05,4.6,1.70031471337262e-05
"1723382","Urinicoccus massiliensis strain FC2, whole genome shotgun sequence",4,1.48302492594144e-05,4,1.47554816951956e-05
"1705","Corynebacterium stationis strain 622=DSM 20302 chromosome, complete genome",3,1.11226869445608e-05,3.9,1.45973947919232e-05
"246196","Mycolicibacterium smegmatis MC2 155, complete sequence",3,1.11226869445608e-05,3.7,1.38249350041901e-05
"203267","Tropheryma whipplei str. Twist, complete sequence",3,1.11226869445608e-05,4.5,1.67064790318767e-05
"521096","Tsukamurella paurometabola DSM 20162, complete sequence",3,1.11226869445608e-05,3.5,1.30374091196392e-05
"203275","Tannerella forsythia 92A2, complete sequence",3,1.11226869445608e-05,2.7,9.92731166956434e-06
"28445","Mycobacterium intermedium strain DSM 44049 NODE_19_length_75669_cov_26.9565, whole genome shotgun sequence",3,1.11226869445608e-05,4.3,1.58296004456041e-05
"272560","Burkholderia pseudomallei K96243 chromosome 1, complete sequence",3,1.11226869445608e-05,2.9,1.08173824069507e-05
"29486","Yersinia ruckeri strain Big Creek 74 chromosome, complete genome",3,1.11226869445608e-05,3.4,1.25032285430789e-05
"40518","Ruminococcus bromii strain YE282, whole genome shotgun sequence",3,1.11226869445608e-05,3,1.11227281827687e-05
"568703","Lacticaseibacillus rhamnosus GG, complete sequence",3,1.11226869445608e-05,3,1.12220459426959e-05
"1121409","Desulfofustis glycolicus DSM 9705, whole genome shotgun sequence",3,1.11226869445608e-05,3.5,1.30104415856519e-05
"95161","Saccharopolyspora flava strain DSM 44771, whole genome shotgun sequence",3,1.11226869445608e-05,2.6,9.60551838008629e-06
"1194083","Tetrasphaera japonica T1-X7, whole genome shotgun sequence",3,1.11226869445608e-05,3,1.10983350533369e-05
"170573","Staphylococcus pettenkoferi strain FDAARGOS_288 chromosome, complete genome",3,1.11226869445608e-05,3.1,1.13208038154861e-05
"1121025","Atopostipes suicloacalis DSM 15692, whole genome shotgun sequence",3,1.11226869445608e-05,3.2,1.17073468684453e-05
"225991","Comamonas aquatica strain CJG chromosome",3,1.11226869445608e-05,3,1.11874218869195e-05
"254161","Halopseudomonas pachastrellae strain JCM 12285, whole genome shotgun sequence",3,1.11226869445608e-05,3.7,1.39023253189062e-05
"1038858","Azorhizobium doebereinerae UFLA1-100 YU1DRAFT_scaffold_49.50_C, whole genome shotgun sequence",3,1.11226869445608e-05,3.5,1.30251959987736e-05
"1002367","Prevotella stercorea DSM 18206 Scfld41, whole genome shotgun sequence",3,1.11226869445608e-05,3,1.11253971277939e-05
"1192197","Pelosinus fermentans JBW45 chromosome, complete genome",3,1.11226869445608e-05,3,1.11002132905483e-05
"499555","Dietzia timorensis strain ID05-A0528 chromosome, complete genome",3,1.11226869445608e-05,3.1,1.13259595462251e-05
"560555","Mycobacterium mantenii strain DSM 45255 NODE_6_length_235456_cov_39.9441, whole genome shotgun sequence",3,1.11226869445608e-05,3,1.11504619582643e-05
"1304275","Salinisphaera hydrothermalis C41B8 contig77, whole genome shotgun sequence",3,1.11226869445608e-05,3,1.11256384748241e-05
"1461260","Leucobacter celer subsp. astrifaciens strain CBX151 contig_151, whole genome shotgun sequence",3,1.11226869445608e-05,2.6,9.68719112639144e-06
"766136","Desulfuribacillus alkaliarsenatis strain AHT28 DSM-24608_Contig_27_85X, whole genome shotgun sequence",3,1.11226869445608e-05,2.5,9.34259236120379e-06
"570277","Endozoicomonas montiporae CL-33 chromosome",3,1.11226869445608e-05,2.4,8.75146689178584e-06
"1202724","Flavobacterium akiainvivens strain IK-1 scaffold00001, whole genome shotgun sequence",3,1.11226869445608e-05,3,1.11189709433346e-05
"1323361","Prescottella defluvii strain Ca11 contig058, whole genome shotgun sequence",3,1.11226869445608e-05,3.1,1.15611235505392e-05
"1387353","Paludisphaera borealis strain PX4 chromosome, complete genome",3,1.11226869445608e-05,3,1.11228245544927e-05
"575540","Isosphaera pallida ATCC 43644, complete sequence",2,7.41512462970721e-06,2,7.41614548240984e-06
"714","Aggregatibacter actinomycetemcomitans strain 624 chromosome, complete genome",2,7.41512462970721e-06,2.2,8.19787536092796e-06
"71421","Haemophilus influenzae Rd KW20, complete sequence",2,7.41512462970721e-06,2.4,8.86698205134675e-06
"1421013","Rhodopseudomonas palustris JSC-3b Scaffold1, whole genome shotgun sequence",2,7.41512462970721e-06,2.2,8.2603760497825e-06
"1267","Sarcina ventriculi strain 2789STDY5834858, whole genome shotgun sequence",2,7.41512462970721e-06,2,7.56700046807529e-06
"333849","Enterococcus faecium DO, complete sequence",2,7.41512462970721e-06,2,7.48792663369364e-06
