"TaxonomyID","Genome","read_count","Proportion","readsEM","EMProportion"
"797277","Halopseudomonas litoralis strain 2SM5 chromosome I",1,1.08237993700549e-05,1,1.10740985070926e-05
"930805","Halioglobus japonicus strain NBRC 107739 chromosome, complete genome",1,1.08237993700549e-05,1.1,1.14223838507812e-05
"570952","Fodinicurvata sediminis DSM 21159 G502DRAFT_scaffold00005.5_C, whole genome shotgun sequence",1,1.08237993700549e-05,1.8,1.93964999704137e-05
"1130080","Alkalibacterium gilvum strain DSM 25751, whole genome shotgun sequence",1,1.08237993700549e-05,1,1.09537548329287e-05
"1157490","Tumebacillus flagellatus strain GST4 Contig093, whole genome shotgun sequence",1,1.08237993700549e-05,1,1.09044918061497e-05
"1229165","Acinetobacter apis strain ANC 5114, whole genome shotgun sequence",1,1.08237993700549e-05,1,1.08414289520755e-05
"1248727","Endosymbiont of unidentified scaly snail isolate Monju chromosome, complete genome",1,1.08237993700549e-05,1,1.05068421859944e-05
"1347368","Bacillus ndiopicus isolate FF3, whole genome shotgun sequence",1,1.08237993700549e-05,1.1,1.16747493290983e-05
"1391653","Vulgatibacter incomptus strain DSM 27710 chromosome, complete genome",1,1.08237993700549e-05,1,1.09640448547815e-05
"1404245","Corynebacterium glyciniphilum AJ 3170 chromosome, complete genome",1,1.08237993700549e-05,1.2,1.28765885886268e-05
"1428644","Mangrovactinospora gilvigriseus strain MUSC 26 205, whole genome shotgun sequence",1,1.08237993700549e-05,1.1,1.23649527778384e-05
"1434072","Halopseudomonas salegens strain CECT 8338 chromosome I",1,1.08237993700549e-05,1.1,1.1801012020543e-05
"1531955","Sinomonas mesophila strain MPKL 26 contig046, whole genome shotgun sequence",1,1.08237993700549e-05,1,1.10159978527761e-05
"1561004","Candidatus Ichthyocystis sparus isolate 2013Arg14, whole genome shotgun sequence",1,1.08237993700549e-05,1,1.09198638344029e-05
"1612308","Methylocapsa palsarum strain NE2, whole genome shotgun sequence",1,1.08237993700549e-05,2.1,2.24106282257214e-05
"1629334","Caedimonas varicaedens, whole genome shotgun sequence",1,1.08237993700549e-05,1.2,1.24494033733959e-05
"1855383","Chelativorans sp. A52C2, whole genome shotgun sequence",1,1.08237993700549e-05,1.5,1.58162643276405e-05
"2029567","Rhodomicrobium sp. R_RK_3 BLEFHOIH_16, whole genome shotgun sequence",1,1.08237993700549e-05,1.2,1.30714355707726e-05
