"TaxonomyID","Genome","read_count","Proportion","readsEM","EMProportion"
"1130080","Alkalibacterium gilvum strain DSM 25751, whole genome shotgun sequence",1,7.94091955848487e-06,1,8.08445810883962e-06
"1221500","Fictibacillus phosphorivorans strain G25-29 chromosome, complete genome",1,7.94091955848487e-06,1.2,9.34092449447585e-06
"1437875","Corynebacterium frankenforstense DSM 45800 strain ST18 chromosome, complete genome",1,7.94091955848487e-06,1.2,9.29279209118025e-06
"1404245","Corynebacterium glyciniphilum AJ 3170 chromosome, complete genome",1,7.94091955848487e-06,1,8.28946156872201e-06
"1774970","Methyloceanibacter stevinii strain R-67176 contig_6, whole genome shotgun sequence",1,7.94091955848487e-06,1.3,1.06078301059133e-05
"1777133","Caballeronia concitans isolate LMG 29315, whole genome shotgun sequence",1,7.94091955848487e-06,1.1,8.4185385860501e-06
"1811193","Streptococcus pantholopis strain TA 26 chromosome, complete genome",1,7.94091955848487e-06,1.5,1.15457377262379e-05
"1814128","Streptococcus halotolerans strain HTS9 chromosome, complete genome",1,7.94091955848487e-06,1.2,9.38788316014046e-06
"1852776","Perlucidibaca aquatica strain BK296 contig_2, whole genome shotgun sequence",1,7.94091955848487e-06,1.4,1.11486800582419e-05
"2054173","Candidatus Coxiella mudrowiae strain CRt chromosome, complete genome",1,7.94091955848487e-06,0.5,4.16264796197838e-06
